ID,Display Name,Category,Sub-Category,Primary Link,Secondary Link,Author Name,Author Link,Active,Date Added,Last Modified,Last Checked,License,Description,Removed From Origin,Stale,Repo Created,Latest Release,Release Version,Release Source
status-83779330,claude-code-statusline,Status Lines,General,https://github.com/rz1989s/claude-code-statusline,,rz1989s,https://github.com/rz1989s,TRUE,2025-09-01:14-56-40,2026-04-12:06-57-39,2026-03-02:01-57-45,MIT,"Enhanced 4-line statusline for Claude Code with themes, cost tracking, and MCP server monitoring",FALSE,FALSE,2025-08-18:06-45-07,2026-04-12:06-58-07,v2.24.0,github-releases
status-e3a9d274,claude-powerline,Status Lines,General,https://github.com/Owloops/claude-powerline,https://www.npmjs.com/package/@owloops/claude-powerline,Owloops,https://github.com/Owloops,TRUE,2025-08-16:06-23-25,2026-04-12:04-45-57,2026-03-02:01-57-48,MIT,"A vim-style powerline statusline for Claude Code with real-time usage tracking, git integration, custom themes, and more",FALSE,FALSE,2025-08-10:08-11-34,2026-04-08:14-10-29,v1.24.4,github-releases
status-bb559460,claudia-statusline,Status Lines,General,https://github.com/hagan/claudia-statusline,,Hagan Franks,https://github.com/hagan,TRUE,2025-10-10:09-41-03,2026-01-17:23-15-29,2026-03-02:01-57-51,MIT,"High-performance Rust-based statusline for Claude Code with persistent stats tracking, progress bars, and optional cloud sync. Features SQLite-first persistence, git integration, context progress bars, burn rate calculation, XDG-compliant with theme support (dark/light, NO_COLOR).",FALSE,FALSE,2025-08-23:03-03-49,2026-01-17:23-22-57,v2.22.1,github-releases
hook-73da34c7,Britfix,Hooks,General,https://github.com/Talieisin/britfix,,Talieisin,https://github.com/Talieisin,TRUE,2025-12-03:07-30-41,2026-03-12:08-24-57,2026-03-02:01-57-53,MIT,"Claude outputs American spellings by default, which can have an impact on: professional credibility, compliance, documentation, and more. Britfix converts to British English, with a Claude Code hook for automatic conversion as files are written. Context-aware: handles code files intelligently by only converting comments and docstrings, never identifiers or string literals.",FALSE,FALSE,2025-12-01:06-50-17,,,
hook-37bef012,CC Notify,Hooks,General,https://github.com/dazuiba/CCNotify,,dazuiba,https://github.com/dazuiba,TRUE,,2025-10-14:02-26-09,2026-03-02:01-57-56,MIT,"CCNotify provides desktop notifications for Claude Code, alerting you to input needs or task completion, with one-click jumps back to VS Code and task duration display.",FALSE,TRUE,2025-07-24:12-57-26,,,
hook-26657310,cchooks,Hooks,General,https://github.com/GowayLee/cchooks,https://pypi.org/project/cchooks/,GowayLee,https://github.com/GowayLee,TRUE,2025-07-29,2026-04-08:08-38-41,2026-03-02:01-57-58,MIT,"A lightweight Python SDK with a clean API and good documentation; simplifies the process of writing hooks and integrating them into your codebase, providing a nice abstraction over the JSON configuration files.",FALSE,TRUE,2025-07-16:11-47-14,2025-11-12:04-35-09,v0.1.5,github-releases
hook-4b08835a,Claude Code Hook Comms (HCOM),Hooks,General,https://github.com/aannoo/claude-hook-comms,https://pypi.org/project/hcom,aannoo,https://github.com/aannoo,TRUE,2025-12-18:06-06-18,2026-04-13:03-19-47,2026-03-02:01-58-02,MIT,"Lightweight CLI tool for real-time communication between Claude Code sub agents using hooks. Enables multi-agent collaboration with @-mention targeting, live dashboard monitoring, and zero-dependency implementation. [NOTE: At the time of posting, this resource is a little unstable - I'm sharing it anyway, because I think it's incredibly promising and creative. I hope by the time you read this, it is production-ready.]",FALSE,FALSE,2025-07-21:02-09-06,2026-04-08:03-12-08,v0.7.10,github-releases
hook-61fc561a,claude-code-hooks-sdk,Hooks,General,https://github.com/beyondcode/claude-hooks-sdk,,beyondcode,https://github.com/beyondcode,TRUE,2025-07-29,2026-01-12:05-58-06,2026-03-02:01-58-05,MIT,"A Laravel-inspired PHP SDK for building Claude Code hook responses with a clean, fluent API. This SDK makes it easy to create structured JSON responses for Claude Code hooks using an expressive, chainable interface.",FALSE,FALSE,2025-07-03:19-44-53,2025-07-03:20-17-57,0.1.0,github-releases
hook-ff4a072b,claude-hooks,Hooks,General,https://github.com/johnlindquist/claude-hooks,,John Lindquist,https://github.com/johnlindquist,TRUE,2025-07-29,2025-08-01:14-42-26,2026-03-02:01-58-07,MIT,A TypeScript-based system for configuring and customizing Claude Code hooks with a powerful and flexible interface.,FALSE,TRUE,2025-07-03:22-10-15,2025-08-01:14-45-16,v2.4.0,github-releases
hook-9cfa9465,Claudio,Hooks,General,https://github.com/ctoth/claudio,,Christopher Toth,https://github.com/ctoth,TRUE,2025-09-30:14-44-46,2026-03-17:00-26-45,2026-03-02:01-58-10,NOT_FOUND,A no-frills little library that adds delightful OS-native sounds to Claude Code via simple hooks. It really sparks joy.,FALSE,FALSE,2025-07-26:21-45-51,2026-03-17:00-28-29,v1.12.0,github-releases
hook-48393ed3,Dippy,Hooks,General,https://github.com/ldayton/Dippy,,Lily Dayton,https://github.com/ldayton,TRUE,2026-02-26:09-48-46,2026-03-22:19-33-23,2026-03-02:01-58-12,MIT,"Auto-approve safe bash commands using AST-based parsing, while prompting for destructive operations. Solves permission fatigue without disabling safety. Supports Claude Code, Gemini CLI, and Cursor.",FALSE,FALSE,2026-01-07:15-11-57,2026-03-22:19-33-56,v0.2.7,github-releases
hook-c8d81568,parry,Hooks,General,https://github.com/vaporif/parry,,Dmytro Onypko,https://github.com/vaporif,TRUE,2026-03-02:07-24-03,2026-04-09:16-22-31,2026-03-02:07-24-03,MIT,"Prompt injection scanner for Claude Code hooks. Scans tool inputs and outputs for injection attacks, secrets, and data exfiltration attempts. [NOTE: Early development phase but worth a look.]",FALSE,FALSE,2026-02-23:05-57-41,2026-03-20:17-39-15,v0.1.3,github-releases
hook-2b995e52,TDD Guard,Hooks,General,https://github.com/nizos/tdd-guard,,Nizar Selander,https://github.com/nizos,TRUE,2025-07-29,2026-04-12:18-19-22,2026-03-02:01-58-15,MIT,A hooks-driven system that monitors file operations in real-time and blocks changes that violate TDD principles.,FALSE,FALSE,2025-07-03:06-11-29,2026-04-06:08-03-47,rspec-v0.3.0,github-releases
hook-3ca1f52e,TypeScript Quality Hooks,Hooks,General,https://github.com/bartolli/claude-code-typescript-hooks,,bartolli,https://github.com/bartolli,TRUE,2025-08-23:23-46-33,2025-08-26:17-11-20,2026-03-02:01-58-18,MIT,"Quality check hook for Node.js TypeScript projects with TypeScript compilation. ESLint auto-fixing, and Prettier formatting. Uses SHA256 config caching for < 5ms validation performance during real-time editing.",FALSE,TRUE,2025-07-21:01-19-57,,,
hook-7dbcf415,Plannotator,Hooks,,https://github.com/backnotprop/plannotator,https://plannotator.ai,backnotprop,https://github.com/backnotprop,TRUE,2026-01-17:04-22-43,2026-04-13:04-46-52,2026-03-02:01-58-21,Apache-2.0,"Interactive plan review UI that intercepts ExitPlanMode via hooks, letting users visually annotate plans with comments, deletions, and replacements before approving or denying with detailed feedback.",FALSE,FALSE,2025-12-28:02-14-10,2026-04-11:19-02-54,v0.17.9,github-releases
cmd-d4f9e2a5,/create-hook,Slash-Commands,General,https://github.com/omril321/automated-notebooklm/blob/main/.claude/commands/create-hook.md,,Omri Lavi,https://github.com/omril321,TRUE,2025-10-01:17-06-21,2026-02-07:09-45-14,2026-03-02:01-58-23,Apache-2.0,"Slash command for hook creation - intelligently prompts you through the creation process with smart suggestions based on your project setup (TS, Prettier, ESLint...).",FALSE,TRUE,2025-07-24:11-37-46,,,
cmd-b37060d6,/linux-desktop-slash-commands,Slash-Commands,General,https://github.com/danielrosehill/Claude-Code-Linux-Desktop-Slash-Commands,,Daniel Rosehill,https://github.com/danielrosehill,TRUE,2025-10-22:12-06-56,2025-10-31:22-31-20,2026-03-02:01-58-26,NOT_FOUND,"A library of slash commands intended specifically to facilitate common and advanced operations on Linux desktop environments (although many would also be useful on Linux servers). Command groups include hardware benchmarking, filesystem organisation, and security posture validation.",FALSE,TRUE,2025-10-21:08-14-40,2025-10-25:23-17-06,25-10-2025,github-releases
cmd-9d234db1,/analyze-issue,Slash-Commands,Version Control & Git,https://github.com/jerseycheese/Narraitor/blob/feature/issue-227-ai-suggestions/.claude/commands/analyze-issue.md,,jerseycheese,https://github.com/jerseycheese,TRUE,,2026-02-06:21-14-20,2026-03-02:01-58-29,MIT,"Fetches GitHub issue details to create comprehensive implementation specifications, analyzing requirements and planning structured approach with clear implementation steps.",FALSE,FALSE,2025-04-28:17-05-33,,,
cmd-b6a797df,/commit,Slash-Commands,Version Control & Git,https://github.com/evmts/tevm-monorepo/blob/main/.claude/commands/commit.md,,evmts,https://github.com/evmts,TRUE,,2026-02-09:21-00-27,2026-03-02:01-58-32,MIT,"Creates git commits using conventional commit format with appropriate emojis, following project standards and creating descriptive messages that explain the purpose of changes.",FALSE,TRUE,2023-02-14:18-40-46,2025-10-04:11-25-52,v1.0.0-next.148,github-releases
cmd-6aeeadd6,/commit-fast,Slash-Commands,Version Control & Git,https://github.com/steadycursor/steadystart/blob/main/.claude/commands/2-commit-fast.md,,steadycursor,https://github.com/steadycursor,TRUE,,2025-08-03:20-24-42,2026-03-02:01-58-35,NOT_FOUND,"Automates git commit process by selecting the first suggested message, generating structured commits with consistent formatting while skipping manual confirmation and removing Claude co-Contributorship footer",FALSE,TRUE,2024-05-14:22-13-33,,,
cmd-2f41bf88,/create-pr,Slash-Commands,Version Control & Git,https://github.com/toyamarinyon/giselle/blob/main/.claude/commands/create-pr.md,,toyamarinyon,https://github.com/toyamarinyon,TRUE,2025-07-29,2025-04-04:14-05-50,2026-03-02:01-58-37,Apache-2.0,"Streamlines pull request creation by handling the entire workflow: creating a new branch, committing changes, formatting modified files with Biome, and submitting the PR.",FALSE,TRUE,2023-12-21:04-25-41,,,
cmd-6f066b19,/create-pull-request,Slash-Commands,Version Control & Git,https://github.com/liam-hq/liam/blob/main/.claude/commands/create-pull-request.md,,liam-hq,https://github.com/liam-hq,TRUE,2025-07-29,2026-03-01:19-19-02,2026-03-02:01-58-40,Apache-2.0,"Provides comprehensive PR creation guidance with GitHub CLI, enforcing title conventions, following template structure, and offering concrete command examples with best practices.",FALSE,TRUE,2024-08-08:02-58-32,2025-11-25:02-37-34,@liam-hq/cli@0.7.24,github-releases
cmd-54c60a04,/create-worktrees,Slash-Commands,Version Control & Git,https://github.com/evmts/tevm-monorepo/blob/main/.claude/commands/create-worktrees.md,,evmts,https://github.com/evmts,TRUE,,2026-02-09:21-00-27,2026-03-02:01-58-43,MIT,"Creates git worktrees for all open PRs or specific branches, handling branches with slashes, cleaning up stale worktrees, and supporting custom branch creation for development.",FALSE,TRUE,2023-02-14:18-40-46,2025-10-04:11-25-52,v1.0.0-next.148,github-releases
cmd-d39b623d,/fix-github-issue,Slash-Commands,Version Control & Git,https://github.com/jeremymailen/kotlinter-gradle/blob/master/.claude/commands/fix-github-issue.md,,jeremymailen,https://github.com/jeremymailen,TRUE,2025-07-29,2026-03-27:15-46-17,2026-03-02:01-58-46,Apache-2.0,"Analyzes and fixes GitHub issues using a structured approach with GitHub CLI for issue details, implementing necessary code changes, running tests, and creating proper commit messages.",FALSE,TRUE,2017-05-07:06-42-09,2026-02-10:23-36-31,5.4.2,github-releases
cmd-85f39721,/fix-issue,Slash-Commands,Version Control & Git,https://github.com/metabase/metabase/blob/master/.claude/commands/fix-issue.md,,metabase,https://github.com/metabase,TRUE,,2026-04-13:04-55-58,2026-03-02:01-58-49,NOASSERTION,"Addresses GitHub issues by taking issue number as parameter, analyzing context, implementing solution, and testing/validating the fix for proper integration.",FALSE,TRUE,2015-02-02:19-28-24,2026-04-09:23-07-27,v0.59.6,github-releases
cmd-16c71a8c,/fix-pr,Slash-Commands,Version Control & Git,https://github.com/metabase/metabase/blob/master/.claude/commands/fix-pr.md,,metabase,https://github.com/metabase,TRUE,,2026-04-13:04-55-58,2026-03-02:01-58-51,NOASSERTION,"Fetches and fixes unresolved PR comments by automatically retrieving feedback, addressing reviewer concerns, making targeted code improvements, and streamlining the review process.",FALSE,TRUE,2015-02-02:19-28-24,2026-04-09:23-07-27,v0.59.6,github-releases
cmd-a1042630,/husky,Slash-Commands,Version Control & Git,https://github.com/evmts/tevm-monorepo/blob/main/.claude/commands/husky.md,,evmts,https://github.com/evmts,TRUE,2025-07-29,2026-02-09:21-00-27,2026-03-02:01-58-54,MIT,"Sets up and manages Husky Git hooks by configuring pre-commit hooks, establishing commit message standards, integrating with linting tools, and ensuring code quality on commits.",FALSE,TRUE,2023-02-14:18-40-46,2025-10-04:11-25-52,v1.0.0-next.148,github-releases
cmd-d32f827c,/update-branch-name,Slash-Commands,Version Control & Git,https://github.com/giselles-ai/giselle/blob/main/.claude/commands/update-branch-name.md,,giselles-ai,https://github.com/giselles-ai,TRUE,,2026-04-06:01-13-12,2026-03-02:01-58-58,Apache-2.0,"Updates branch names with proper prefixes and formats, enforcing naming conventions, supporting semantic prefixes, and managing remote branch updates.",FALSE,TRUE,2023-12-21:04-25-41,2026-04-03:00-08-22,v0.75.3,github-releases
cmd-193fe5e1,/check,Slash-Commands,Code Analysis & Testing,https://github.com/rygwdn/slack-tools/blob/main/.claude/commands/check.md,,rygwdn,https://github.com/rygwdn,TRUE,2025-07-29,2025-05-30:20-29-46,2026-03-02:01-59-01,NOT_FOUND,"Performs comprehensive code quality and security checks, featuring static analysis integration, security vulnerability scanning, code style enforcement, and detailed reporting.",FALSE,TRUE,2025-03-27:18-56-11,,,
cmd-9944dc47,/clean,Slash-Commands,Code Analysis & Testing,https://github.com/Graphlet-AI/eridu/blob/main/.claude/commands/clean.md,,Graphlet-AI,https://github.com/Graphlet-AI,FALSE,2025-07-29,2025-05-16:04-28-34,2025-11-02:18-36-47,Apache-2.0,"Addresses code formatting and quality issues by fixing black formatting problems, organizing imports with isort, resolving flake8 linting issues, and correcting mypy type errors.",FALSE,,2025-03-25:18-33-44,,,
cmd-f77c03b5,/code_analysis,Slash-Commands,Code Analysis & Testing,https://github.com/kingler/n8n_agent/blob/main/.claude/commands/code_analysis.md,,kingler,https://github.com/kingler,TRUE,2025-07-29,2025-05-16:17-30-29,2026-03-02:01-59-03,NOT_FOUND,"Provides a menu of advanced code analysis commands for deep inspection, including knowledge graph generation, optimization suggestions, and quality evaluation.",FALSE,TRUE,2025-05-16:17-30-29,,,
cmd-c76ed84c,/optimize,Slash-Commands,Code Analysis & Testing,https://github.com/to4iki/ai-project-rules/blob/main/.claude/commands/optimize.md,,to4iki,https://github.com/to4iki,TRUE,2025-07-29,2025-04-24:16-18-21,2026-03-02:01-59-07,MIT,"Analyzes code performance to identify bottlenecks, proposing concrete optimizations with implementation guidance for improved application performance.",FALSE,TRUE,2025-04-24:16-18-21,,,
cmd-3c922eaa,/repro-issue,Slash-Commands,Code Analysis & Testing,https://github.com/rzykov/metabase/blob/master/.claude/commands/repro-issue.md,,rzykov,https://github.com/rzykov,TRUE,2025-07-29,2025-05-16:07-51-12,2026-03-02:01-59-10,NOASSERTION,"Creates reproducible test cases for GitHub issues, ensuring tests fail reliably and documenting clear reproduction steps for developers.",FALSE,TRUE,2015-02-02:19-28-24,,,
cmd-051321ab,/tdd,Slash-Commands,Code Analysis & Testing,https://github.com/zscott/pane/blob/main/.claude/commands/tdd.md,,zscott,https://github.com/zscott,TRUE,2025-07-29,2025-03-07:16-35-10,2026-03-02:01-59-13,NOT_FOUND,"Guides development using Test-Driven Development principles, enforcing Red-Green-Refactor discipline, integrating with git workflow, and managing PR creation.",FALSE,TRUE,2025-03-05:17-52-00,2025-03-05:18-00-20,v0.1.1,github-releases
cmd-cccacca2,/tdd-implement,Slash-Commands,Code Analysis & Testing,https://github.com/jerseycheese/Narraitor/blob/feature/issue-227-ai-suggestions/.claude/commands/tdd-implement.md,,jerseycheese,https://github.com/jerseycheese,TRUE,,2026-02-06:21-14-20,2026-03-02:01-59-16,MIT,"Implements Test-Driven Development by analyzing feature requirements, creating tests first (red), implementing minimal passing code (green), and refactoring while maintaining tests.",FALSE,FALSE,2025-04-28:17-05-33,,,
cmd-01b57069,/context-prime,Slash-Commands,Context Loading & Priming,https://github.com/elizaOS/elizaos.github.io/blob/main/.claude/commands/context-prime.md,,elizaOS,https://github.com/elizaOS,TRUE,2025-07-29,2026-04-08:05-12-05,2026-03-02:01-59-19,MIT,"Primes Claude with comprehensive project understanding by loading repository structure, setting development context, establishing project goals, and defining collaboration parameters.",FALSE,TRUE,2024-11-10:03-44-30,,,
cmd-82556482,/initref,Slash-Commands,Context Loading & Priming,https://github.com/okuvshynov/cubestat/blob/main/.claude/commands/initref.md,,okuvshynov,https://github.com/okuvshynov,TRUE,2025-07-29,2025-08-11:02-27-35,2026-03-02:01-59-22,MIT,"Initializes reference documentation structure with standard doc templates, API reference setup, documentation conventions, and placeholder content generation.",FALSE,TRUE,2023-02-08:15-30-18,2025-03-04:14-34-45,v0.3.4,github-releases
cmd-e7fde689,/load-llms-txt,Slash-Commands,Context Loading & Priming,https://github.com/ethpandaops/xatu-data/blob/master/.claude/commands/load-llms-txt.md,,ethpandaops,https://github.com/ethpandaops,TRUE,2025-07-29,2026-04-13:00-13-51,2026-03-02:01-59-25,MIT,"Loads LLM configuration files to context, importing specific terminology, model configurations, and establishing baseline terminology for AI discussions.",FALSE,TRUE,2024-03-26:00-43-31,,,
cmd-cc5f7cd3,/load_coo_context,Slash-Commands,Context Loading & Priming,https://github.com/Mjvolk3/torchcell/blob/main/.claude/commands/load_coo_context.md,,Mjvolk3,https://github.com/Mjvolk3,TRUE,,2026-01-27:17-11-51,2026-03-02:01-59-27,NOT_FOUND,"References specific files for sparse matrix operations, explains transform usage, compares with previous approaches, and sets data formatting context for development.",FALSE,TRUE,2023-07-24:22-56-56,2025-08-07:03-40-40,v1.1.0,github-releases
cmd-63a682e3,/load_dango_pipeline,Slash-Commands,Context Loading & Priming,https://github.com/Mjvolk3/torchcell/blob/main/.claude/commands/load_dango_pipeline.md,,Mjvolk3,https://github.com/Mjvolk3,TRUE,,2026-01-27:17-11-51,2026-03-02:01-59-30,NOT_FOUND,"Sets context for model training by referencing pipeline files, establishing working context, and preparing for pipeline work with relevant documentation.",FALSE,TRUE,2023-07-24:22-56-56,2025-08-07:03-40-40,v1.1.0,github-releases
cmd-f4c7bb3c,/prime,Slash-Commands,Context Loading & Priming,https://github.com/yzyydev/AI-Engineering-Structure/blob/main/.claude/commands/prime.md,,yzyydev,https://github.com/yzyydev,TRUE,2025-07-29,2025-09-15:14-45-35,2026-03-02:01-59-33,NOT_FOUND,"Sets up initial project context by viewing directory structure and reading key files, creating standardized context with directory visualization and key documentation focus.",FALSE,TRUE,2025-05-08:10-26-38,,,
cmd-acaa3ecd,/rsi,Slash-Commands,Context Loading & Priming,https://github.com/ddisisto/si/blob/main/.claude/commands/rsi.md,,ddisisto,https://github.com/ddisisto,TRUE,2025-07-29,2025-05-20:01-27-49,2026-03-02:01-59-36,NOT_FOUND,"Reads all commands and key project files to optimize AI-assisted development by streamlining the process, loading command context, and setting up for better development workflow.",FALSE,TRUE,2025-05-17:02-27-16,,,
cmd-989ec43f,/add-to-changelog,Slash-Commands,Documentation & Changelogs,https://github.com/berrydev-ai/blockdoc-python/blob/main/.claude/commands/add-to-changelog.md,,berrydev-ai,https://github.com/berrydev-ai,TRUE,2025-07-29,2025-04-28:15-54-32,2026-03-02:01-59-39,MIT,"Adds new entries to changelog files while maintaining format consistency, properly documenting changes, and following established project standards for version tracking.",FALSE,TRUE,2025-03-23:18-25-35,2025-04-25:23-49-58,1.1.0,github-releases
cmd-416793e8,/create-docs,Slash-Commands,Documentation & Changelogs,https://github.com/jerseycheese/Narraitor/blob/feature/issue-227-ai-suggestions/.claude/commands/create-docs.md,,jerseycheese,https://github.com/jerseycheese,TRUE,2025-07-29,2026-02-06:21-14-20,2026-03-02:01-59-41,MIT,"Analyzes code structure and purpose to create comprehensive documentation detailing inputs/outputs, behavior, user interaction flows, and edge cases with error handling.",FALSE,FALSE,2025-04-28:17-05-33,,,
cmd-4d612ab9,/docs,Slash-Commands,Documentation & Changelogs,https://github.com/slunsford/coffee-analytics/blob/main/.claude/commands/docs.md,,slunsford,https://github.com/slunsford,TRUE,2025-07-29,2025-11-13:18-34-17,2026-03-02:01-59-45,NOT_FOUND,"Generates comprehensive documentation that follows project structure, documenting APIs and usage patterns with consistent formatting for better user understanding.",FALSE,TRUE,2023-08-22:19-12-06,,,
cmd-7c4c3c47,/explain-issue-fix,Slash-Commands,Documentation & Changelogs,https://github.com/hackdays-io/toban-contribution-viewer/blob/main/.claude/commands/explain-issue-fix.md,,hackdays-io,https://github.com/hackdays-io,TRUE,2025-07-29,2025-05-17:15-04-46,2026-03-02:01-59-48,NOT_FOUND,"Documents solution approaches for GitHub issues, explaining technical decisions, detailing challenges overcome, and providing implementation context for better understanding.",FALSE,TRUE,2025-03-30:07-41-02,,,
cmd-7767f28f,/update-docs,Slash-Commands,Documentation & Changelogs,https://github.com/Consiliency/Flutter-Structurizr/blob/main/.claude/commands/update-docs.md,,Consiliency,https://github.com/Consiliency,TRUE,2025-07-29,2025-05-22:23-41-19,2026-03-02:01-59-51,MIT,"Reviews current documentation status, updates implementation progress, reviews phase documents, and maintains documentation consistency across the project.",FALSE,TRUE,2025-05-12:23-16-35,,,
cmd-39a87802,/release,Slash-Commands,CI / Deployment,https://github.com/kelp/webdown/blob/main/.claude/commands/release.md,,kelp,https://github.com/kelp,TRUE,2025-07-29,2026-03-28:18-36-41,2026-03-02:01-59-55,MIT,"Manages software releases by updating changelogs, reviewing README changes, evaluating version increments, and documenting release changes for better version tracking.",FALSE,TRUE,2025-03-15:18-37-39,2026-03-28:18-25-16,v0.8.2,github-releases
cmd-88d84cb6,/run-ci,Slash-Commands,CI / Deployment,https://github.com/hackdays-io/toban-contribution-viewer/blob/main/.claude/commands/run-ci.md,,hackdays-io,https://github.com/hackdays-io,TRUE,,2025-05-17:15-04-46,2026-03-02:01-59-57,NOT_FOUND,"Activates virtual environments, runs CI-compatible check scripts, iteratively fixes errors, and ensures all tests pass before completion.",FALSE,TRUE,2025-03-30:07-41-02,,,
cmd-8856ecb4,/create-command,Slash-Commands,Project & Task Management,https://github.com/scopecraft/command/blob/main/.claude/commands/create-command.md,,scopecraft,https://github.com/scopecraft,TRUE,2025-07-29,2025-11-09:12-20-07,2026-03-02:02-00-01,NOT_FOUND,"Guides Claude through creating new custom commands with proper structure by analyzing requirements, templating commands by category, enforcing command standards, and creating supporting documentation.",FALSE,TRUE,2025-05-10:17-23-27,2025-06-06:04-25-20,v0.16.0,github-releases
cmd-0420f9cb,/create-plan,Slash-Commands,Project & Task Management,https://github.com/hesreallyhim/inkverse-fork/blob/preserve-claude-resources/.claude/commands/create-plan.md,,taddyorg,https://github.com/taddyorg,TRUE,2025-07-29,2026-01-28:06-09-49,2026-01-20:01-15-59,AGPL-3.0,"Generates comprehensive product requirement documents outlining detailed specifications, requirements, and features following standardized document structure and format.",TRUE,TRUE,2025-05-06:21-28-47,,,
cmd-ec48035a,/create-prp,Slash-Commands,Project & Task Management,https://github.com/Wirasm/claudecode-utils/blob/main/.claude/commands/create-prp.md,,Wirasm,https://github.com/Wirasm,TRUE,2025-07-29,2025-05-21:11-01-32,2026-03-02:02-00-05,MIT,"Creates product requirement plans by reading PRP methodology, following template structure, creating comprehensive requirements, and structuring product definitions for development.",FALSE,TRUE,2025-05-11:18-23-30,,,
cmd-2981aaf0,/do-issue,Slash-Commands,Project & Task Management,https://github.com/jerseycheese/Narraitor/blob/feature/issue-227-ai-suggestions/.claude/commands/do-issue.md,,jerseycheese,https://github.com/jerseycheese,TRUE,,2026-02-06:21-14-20,2026-03-02:02-00-08,MIT,"Implements GitHub issues with manual review points, following a structured approach with issue number parameter and offering alternative automated mode for efficiency.",FALSE,FALSE,2025-04-28:17-05-33,,,
