ID,Display Name,Category,Sub-Category,Primary Link,Secondary Link,Author Name,Author Link,Active,Date Added,Last Modified,Last Checked,License,Description,Removed From Origin,Stale,Repo Created,Latest Release,Release Version,Release Source
wf-2fdeff7e,Ralph Wiggum Marketer,Workflows & Knowledge Guides,Ralph Wiggum,https://github.com/muratcankoylan/ralph-wiggum-marketer,,Muratcan Koylan,https://github.com/muratcankoylan,TRUE,2026-01-13:14-06-16,2026-04-09:14-00-56,2026-03-02:01-55-27,NOT_FOUND,"A Claude Code plugin that provides an autonomous AI copywriter,  integrating the Ralph loop with customized knowledge bases for market research agents. The agents do the research, Ralph writes the copy, you stay in bed. Whether or not you practice Ralph-Driven Development (RDD), I think these projects are interesting and creative explorations of general agentic patterns.",FALSE,FALSE,2026-01-07:07-49-14,,,
wf-5e01a9a6,Ralph Wiggum Plugin,Workflows & Knowledge Guides,Ralph Wiggum,https://github.com/anthropics/claude-code/tree/4f18698a9ed25517861a75125b526e319bcf8354/plugins/ralph-wiggum,,Anthropic PBC,https://github.com/anthropics,FALSE,2026-01-10:21-13-16,2026-01-14:00-03-57,2026-01-14:16-36-08,&copy;,"The official Anthropic implementation of the Ralph Wiggum technique for iterative, self-referential AI development loops in Claude Code.",FALSE,FALSE,2025-02-22:17-29-29,2026-01-14:00-04-17,v2.1.7,github-releases
wf-bc51a50b,ralph-orchestrator,Workflows & Knowledge Guides,Ralph Wiggum,https://github.com/mikeyobrien/ralph-orchestrator,https://mikeyobrien.github.io/ralph-orchestrator/,mikeyobrien,https://github.com/mikeyobrien,TRUE,2026-01-10:19-24-51,2026-04-11:01-18-24,2026-03-02:01-55-30,MIT,"Ralph Orchestrator implements the simple but effective ""Ralph Wiggum"" technique for autonomous task completion, continuously running an AI agent against a prompt file until the task is marked as complete or limits are reached. This implementation provides a robust, well-tested, and feature-complete orchestration system for AI-driven development. Also cited in the Anthropic Ralph plugin documentation.",FALSE,FALSE,2025-09-07:16-55-41,2026-04-10:17-00-07,v2.9.2,github-releases
wf-316367ff,ralph-wiggum-bdd,Workflows & Knowledge Guides,Ralph Wiggum,https://github.com/marcindulak/ralph-wiggum-bdd,,marcindulak,https://github.com/marcindulak,TRUE,2026-02-03:05-23-14,2026-04-12:07-50-40,2026-03-02:01-55-33,Apache-2.0,"A standalone Bash script for Behavior-Driven Development with Ralph Wiggum Loop. In principle, while running unattended, the script can keep code and requirements in sync, but in practice it still requires interactive human supervision, so it supports both modes. The script is standalone and can be modified and committed into your project.",FALSE,FALSE,2026-01-20:03-11-32,,,
wf-aa051a6c,The Ralph Playbook,Workflows & Knowledge Guides,Ralph Wiggum,https://github.com/ClaytonFarr/ralph-playbook,,Clayton Farr,https://github.com/ClaytonFarr,TRUE,2026-01-13:04-31-02,2026-03-06:21-56-54,2026-03-02:01-55-35,NOT_FOUND,"A remarkably detailed and comprehensive guide to the Ralph Wiggum technique, featuring well-written theoretical commentary paired with practical guidelines and advice.",FALSE,FALSE,2026-01-09:21-54-12,,,
tool-9f8d507e,cc-sessions,Tooling,General,https://github.com/GWUDCAP/cc-sessions,,toastdev,https://github.com/satoastshi,TRUE,2025-10-24:22-04-36,2025-10-17:14-50-52,2026-03-02:01-55-38,MIT,An opinionated approach to productive development with Claude Code,FALSE,TRUE,2025-08-26:17-02-09,2025-10-17:13-34-37,v0.3.6,github-releases
hook-edd83641,cc-tools,Tooling,General,https://github.com/Veraticus/cc-tools,,Josh Symonds,https://github.com/Veraticus,TRUE,2025-07-29,2026-01-22:00-17-15,2026-03-02:01-55-42,NOT_FOUND,"High-performance Go implementation of Claude Code hooks and utilities. Provides smart linting, testing, and statusline generation with minimal overhead.",FALSE,FALSE,2025-08-25:23-40-18,,,
tool-b7bb841e,ccexp,Tooling,General,https://github.com/nyatinte/ccexp,https://www.npmjs.com/package/ccexp,nyatinte,https://github.com/nyatinte,TRUE,2025-07-29,2025-11-08:18-40-34,2026-03-02:01-55-44,MIT,Interactive CLI tool for discovering and managing Claude Code configuration files and slash commands with a beautiful terminal UI.,FALSE,TRUE,2025-06-30:16-28-36,2025-07-30:12-59-21,v4.0.0,github-releases
tool-d9c9bde8,cchistory,Tooling,General,https://github.com/eckardt/cchistory,,eckardt,https://github.com/eckardt,TRUE,2025-08-30:01-30-34,2025-10-23:11-41-46,2026-03-02:01-55-47,MIT,"Like the shell history command but for your Claude Code sessions. Easily list all Bash or ""Bash-mode"" (`!`) commands Claude Code ran in a session for reference.",FALSE,TRUE,2025-06-07:16-37-43,2025-09-10:18-14-40,v0.2.1,github-releases
tool-48212d39,cclogviewer,Tooling,General,https://github.com/Brads3290/cclogviewer,,Brad S.,https://github.com/Brads3290,TRUE,2025-08-05:11-48-39,2025-08-08:08-12-45,2026-03-02:01-55-49,MIT,A humble but handy utility for viewing Claude Code `.jsonl` conversation files in a pretty HTML UI.,FALSE,TRUE,2025-07-27:23-02-49,,,
tool-d95e578f,Claude Code Templates,Tooling,General,https://github.com/davila7/claude-code-templates,https://www.npmjs.com/package/claude-code-templates,Daniel Avila,https://github.com/davila7,TRUE,2025-08-24:09-32-10,2026-04-13:04-10-51,2026-03-02:01-55-52,MIT,"Incredibly awesome collection of resources from every category in this list, presented with a neatly polished UI, great features like usage dashboard, analytics, and everything from slash commands to hooks to agents. An awesome companion for this awesome list.",FALSE,FALSE,2025-07-04:01-35-24,2025-11-15:20-41-43,v1.28.3,github-releases
tool-552cdcdf,Claude Composer,Tooling,General,https://github.com/possibilities/claude-composer,,Mike Bannister,https://github.com/possibilities,TRUE,2025-07-29,2025-07-31:02-29-50,2026-03-02:01-55-54,Unlicense,A tool that adds small enhancements to Claude Code.,FALSE,TRUE,2025-05-28:13-05-08,,,
tool-ca25af98,Claude Hub,Tooling,General,https://github.com/claude-did-this/claude-hub,,Claude Did This,https://github.com/claude-did-this,TRUE,2025-07-29,2025-06-20:16-16-08,2026-03-02:01-55-57,NOT_FOUND,"A webhook service that connects Claude Code to GitHub repositories, enabling AI-powered code assistance directly through pull requests and issues. This integration allows Claude to analyze repositories, answer technical questions, and help developers understand and improve their codebase through simple @mentions.",FALSE,TRUE,2025-05-20:17-01-59,2025-05-31:18-48-30,v0.1.1,github-releases
tool-0b63bd5f,Claude Session Restore,Tooling,General,https://github.com/ZENG3LD/claude-session-restore,,ZENG3LD,https://github.com/ZENG3LD,TRUE,2026-01-29:01-51-46,2026-01-26:07-54-17,2026-03-02:01-56-00,NOASSERTION,Efficiently restore context from previous Claude Code sessions by analyzing session files and git history. Features multi-factor data collection across numerous Claude Code capacities with time-based filtering. Uses tail-based parsing for efficient handling of large session files up to 2GB. Includes both a CLI tool for manual analysis and a Claude Code skill for automatic session restoration.,FALSE,FALSE,2026-01-26:07-13-54,,,
tool-3bb5a470,claude-code-tools,Tooling,General,https://github.com/pchalasani/claude-code-tools,,Prasad Chalasani,https://github.com/pchalasani,TRUE,2025-08-05:12-08-07,2026-04-02:22-17-59,2026-03-02:01-56-02,MIT,"Well-crafted toolset for session continuity, featuring skills/commands to avoid compaction and recover context across sessions with cross-agent handoff between Claude Code and Codex CLI. Includes a fast Rust/Tantivy-powered full-text session search (TUI for humans, skill/CLI for agents), tmux-cli skill + command for interacting with scripts and CLI agents, and safety hooks to block dangerous commands.",FALSE,FALSE,2025-07-31:11-39-16,2026-03-26:18-24-03,v1.11.1,github-releases
tool-8b0193b7,claude-starter-kit,Tooling,General,https://github.com/serpro69/claude-starter-kit,,serpro69,https://github.com/serpro69,TRUE,2025-12-06:09-40-40,2026-04-09:08-36-45,2026-03-02:01-56-05,MIT,"This is a starter template repository designed to provide a complete development environment for Claude-Code with pre-configured MCP servers and tools for AI-powered development workflows. The repository is intentionally minimal, containing only configuration templates for three primary systems: Claude Code, Serena, and Task Master.",FALSE,FALSE,2025-10-17:10-31-30,2026-04-08:18-48-04,v0.7.6,github-releases
tool-1cbdd0fb,claudekit,Tooling,General,https://github.com/carlrannaberg/claudekit,https://www.npmjs.com/package/claudekit,Carl Rannaberg,https://github.com/carlrannaberg,TRUE,2025-08-24:07-25-28,2026-03-31:20-43-45,2026-03-02:01-56-08,MIT,"Impressive CLI toolkit providing auto-save checkpointing, code quality hooks, specification generation and execution, and 20+ specialized subagents including oracle (gpt-5), code-reviewer (6-aspect deep analysis), ai-sdk-expert (Vercel AI SDK), typescript-expert and many more for Claude Code workflows.",FALSE,FALSE,2025-07-11:19-10-32,2026-03-31:20-45-18,v0.9.5,github-releases
tool-af235370,Container Use,Tooling,General,https://github.com/dagger/container-use,,dagger,https://github.com/dagger,TRUE,2025-07-29,2026-02-23:12-37-45,2026-03-02:01-56-11,Apache-2.0,Development environments for coding agents. Enable multiple agents to work safely and independently with your preferred stack.,FALSE,FALSE,2025-05-27:17-37-49,2025-08-19:22-31-40,v0.4.2,github-releases
tool-b3562922,ContextKit,Tooling,General,https://github.com/FlineDev/ContextKit,,Cihat Gündüz,https://github.com/Jeehut,TRUE,2025-10-10:09-45-34,2026-03-10:00-49-40,2026-03-02:01-56-14,MIT,"A systematic development framework that transforms Claude Code into a proactive development partner. Features 4-phase planning methodology, specialized quality agents, and structured workflows that help AI produce production-ready code on first try.",FALSE,FALSE,2025-09-12:09-49-38,2025-10-17:14-33-20,0.2.0,github-releases
tool-6e6f1ae1,recall,Tooling,General,https://github.com/zippoxer/recall,,zippoxer,https://github.com/zippoxer,TRUE,2025-12-03:07-17-55,2026-01-14:07-49-55,2026-03-02:01-56-16,MIT,"Full-text search your Claude Code sessions. Run `recall` in terminal, type to search, Enter to resume. Alternative to `claude --resume`.",FALSE,FALSE,2025-11-28:03-10-12,2026-01-13:18-50-54,v0.5.0,github-releases
tool-5845fda0,Rulesync,Tooling,General,https://github.com/dyoshikawa/rulesync,,dyoshikawa,https://github.com/dyoshikawa,TRUE,2025-10-16:13-16-02,2026-04-12:14-53-56,2026-03-02:01-56-19,MIT,"A Node.js CLI tool that automatically generates configs (rules, ignore files, MCP servers, commands, and subagents) for various AI coding agents. Rulesync can convert configs between Claude Code and other AI agents in both directions.",FALSE,FALSE,2025-06-18:13-17-53,2026-04-08:05-15-18,v7.28.0,github-releases
tool-a5798d4b,run-claude-docker,Tooling,General,https://github.com/icanhasjonas/run-claude-docker,,Jonas,https://github.com/icanhasjonas/,TRUE,2025-09-26:05-55-44,2025-08-14:21-00-39,2026-03-02:01-56-21,MIT,"A self-contained Docker runner that forwards your current workspace into a safe(r) isolated docker container, where you still have access to your Claude Code settings, authentication, ssh agent, pgp, optionally aws keys etc.",FALSE,TRUE,2025-08-13:19-28-10,,,
tool-4a5cf064,stt-mcp-server-linux,Tooling,General,https://github.com/marcindulak/stt-mcp-server-linux,,marcindulak,https://github.com/marcindulak,TRUE,2025-09-13:02-17-09,2026-01-10:20-37-37,2026-03-02:01-56-24,Apache-2.0,"A push-to-talk speech transcription setup for Linux using a Python MCP server. Runs locally in Docker with no external API calls. Your speech is recorded, transcribed into text, and then sent to Claude running in a Tmux session.",FALSE,FALSE,2025-09-07:00-38-51,,,
tool-5f5d572e,SuperClaude,Tooling,General,https://github.com/SuperClaude-Org/SuperClaude_Framework,https://superclaude.netlify.app/,SuperClaude-Org,https://github.com/SuperClaude-Org,TRUE,2025-09-11:13-42-12,2026-03-22:17-33-37,2026-03-02:01-56-26,MIT,"A versatile configuration framework that enhances Claude Code with specialized commands, cognitive personas, and development methodologies, such as ""Introspection"" and ""Orchestration"".",FALSE,FALSE,2025-07-14:12-28-11,2026-03-22:17-34-39,v4.3.0,github-releases
tool-8d2e7868,tweakcc,Tooling,General,https://github.com/Piebald-AI/tweakcc,,Piebald-AI,https://github.com/Piebald-AI,TRUE,,2026-04-12:03-14-57,2026-03-02:01-56-29,MIT,Command-line tool to customize your Claude Code styling.,FALSE,FALSE,2025-07-20:21-30-47,2026-03-05:19-05-20,v4.0.11,github-releases
tool-0b63c72c,Vibe-Log,Tooling,General,https://github.com/vibe-log/vibe-log-cli,,Vibe-Log,https://github.com/vibe-log,TRUE,2025-10-10:10-38-18,2025-12-10:22-44-22,2026-03-02:01-56-32,MIT,"Analyzes your Claude Code prompts locally (using CC), provides intelligent session analysis and actionable strategic guidance - works in the statusline and produces very pretty HTML reports as well. Easy to install and remove.",FALSE,FALSE,2025-08-15:18-42-36,2025-12-05:16-47-32,v0.8.6,github-releases
tool-fcf2812e,viwo-cli,Tooling,General,https://github.com/OverseedAI/viwo,,Hal Shin,https://github.com/hal-shin,TRUE,2025-12-06:09-03-50,2026-04-10:23-10-43,2026-03-02:01-56-34,MIT,Run Claude Code in a Docker container with git worktrees as volume mounts to enable safer usage of `--dangerously-skip-permissions` for frictionless one-shotting prompts. Allows users to spin up multiple instances of Claude Code in the background easily with reduced permission fatigue.,FALSE,FALSE,2025-09-04:17-05-44,2026-04-10:22-55-33,v0.10.0,github-releases
tool-1e4657fd,VoiceMode MCP,Tooling,General,https://github.com/mbailey/voicemode,https://getvoicemode.com,Mike Bailey,https://github.com/mbailey,TRUE,2025-10-16:12-54-25,2026-03-29:10-03-47,2026-03-02:01-56-37,MIT,VoiceMode MCP brings natural conversations to Claude Code. It supports any OpenAI API compatible voice services and installs free and open source voice services (Whisper.cpp and Kokoro-FastAPI).,FALSE,FALSE,2025-06-08:16-20-50,2026-03-13:14-49-26,v8.5.1,github-releases
tool-984936a7,Claude Code Chat,Tooling,IDE Integrations,https://marketplace.visualstudio.com/items?itemName=AndrePimenta.claude-code-chat,,andrepimenta,https://github.com/andrepimenta,TRUE,,,2025-07-18:02-03-39,&copy;,An elegant and user-friendly Claude Code chat interface for VS Code.,FALSE,,,,,
tool-5ab1a854,claude-code-ide.el,Tooling,IDE Integrations,https://github.com/manzaltu/claude-code-ide.el,,manzaltu,https://github.com/manzaltu,TRUE,2025-08-07:18-26-57,2026-04-02:05-20-24,2026-03-02:01-56-40,GPL-3.0,"claude-code-ide.el integrates Claude Code with Emacs, like Anthropic’s VS Code/IntelliJ extensions. It shows ediff-based code suggestions, pulls LSP/flymake/flycheck diagnostics, and tracks buffer context. It adds an extensible MCP tool support for symbol refs/defs, project metadata, and tree-sitter AST queries.",FALSE,FALSE,2025-06-23:21-33-22,,,
tool-941ef941,claude-code.el,Tooling,IDE Integrations,https://github.com/stevemolitor/claude-code.el,,stevemolitor,https://github.com/stevemolitor,TRUE,2025-07-29,2025-12-18:22-56-06,2026-03-02:01-56-42,Apache-2.0,An Emacs interface for Claude Code CLI.,FALSE,FALSE,2025-03-13:04-40-23,,,
tool-0607ef06,claude-code.nvim,Tooling,IDE Integrations,https://github.com/greggh/claude-code.nvim,,greggh,https://github.com/greggh,TRUE,2025-07-29,2026-02-04:14-44-50,2026-03-02:01-56-45,MIT,A seamless integration between Claude Code AI assistant and Neovim.,FALSE,FALSE,2025-02-24:21-33-14,2025-03-21:14-43-57,v0.4.3,github-releases
tool-7e19bf77,Claudix - Claude Code for VSCode,Tooling,IDE Integrations,https://github.com/Haleclipse/Claudix,,Haleclipse,https://github.com/Haleclipse,TRUE,2025-12-06:14-05-06,2026-04-01:19-15-29,2026-03-02:01-56-47,AGPL-3.0,"A VSCode extension that brings Claude Code directly into your editor with interactive chat interface, session management, intelligent file operations, terminal execution, and real-time streaming responses. Built with Vue 3, TypeScript.",FALSE,FALSE,2025-11-13:12-04-40,2026-03-13:02-33-48,0.3.9-dev,github-releases
tool-631dbe0f,CC Usage,Tooling,Usage Monitors,https://github.com/ryoppippi/ccusage,,ryoppippi,https://github.com/ryoppippi,TRUE,2025-07-29,2026-04-06:10-10-20,2026-03-02:01-56-50,NOASSERTION,"Handy CLI tool for managing and analyzing Claude Code usage, based on analyzing local Claude Code logs. Presents a nice dashboard regarding cost information, token consumption, etc.",FALSE,FALSE,2025-05-29:17-51-05,2026-03-10:06-30-56,v18.0.10,github-releases
tool-ec858306,ccflare,Tooling,Usage Monitors,https://github.com/snipeship/ccflare,https://ccflare.com/,snipeship,https://github.com/snipeship,TRUE,2025-08-19:01-02-03,2025-08-24:20-28-28,2026-03-02:01-56-52,MIT,"Claude Code usage dashboard with a web-UI that would put Tableau to shame. Thoroughly comprehensive metrics, frictionless setup, detailed logging, really really nice UI.",FALSE,TRUE,2025-07-25:08-34-30,,,
tool-fe142d2f,ccflare -> **better-ccflare**,Tooling,Usage Monitors,https://github.com/tombii/better-ccflare/,,tombii,https://github.com/tombii,TRUE,2025-12-05:14-19-09,2026-04-12:22-09-55,2026-03-02:01-56-55,MIT,"A well-maintained and feature-enhanced fork of the glorious `ccflare` usage dashboard by @snipeship (which at the time of writing has not had an update in a few months). `better-ccflare` builds on this foundation with some performance enhancements, extended provider support, bug fixes, Docker deployment, and more.",FALSE,FALSE,2025-07-25:08-34-30,2026-04-12:22-15-28,v3.4.0,github-releases
tool-ca599740,Claude Code Usage Monitor,Tooling,Usage Monitors,https://github.com/Maciek-roboblog/Claude-Code-Usage-Monitor,,Maciek-roboblog,https://github.com/Maciek-roboblog,TRUE,2025-07-29,2025-07-23:22-21-42,2026-03-02:01-56-57,MIT,"A real-time terminal-based tool for monitoring Claude Code token usage. It shows live token consumption, burn rate, and predictions for token depletion. Features include visual progress bars, session-aware analytics, and support for multiple subscription plans.",FALSE,TRUE,2025-06-18:23-56-54,2025-07-23:22-13-19,v3.1.0,github-releases
tool-61d0c1d6,Claudex,Tooling,Usage Monitors,https://github.com/kunwar-shah/claudex,https://kunwar-shah.github.io/claudex/#/,Kunwar Shah,https://github.com/kunwar-shah,TRUE,2025-11-01:06-27-56,2026-02-14:18-09-14,2026-03-02:01-57-00,MIT,"Claudex - A web-based browser for exploring your Claude Code conversation history across projects. Indexes your codebase for full-text search. Nice, easy-to-navigate UI. Simple dashboard interface for high-level analytics, and multiple export options as well. (And completely local w/ no telemetry!)",FALSE,FALSE,2025-09-12:08-30-58,2026-02-12:13-09-53,v1.3.0,github-releases
tool-a375ba14,viberank,Tooling,Usage Monitors,https://github.com/sculptdotfun/viberank,,nikshepsvn,https://github.com/nikshepsvn,TRUE,2025-08-07:18-55-54,2026-01-26:03-24-16,2026-03-02:01-57-03,MIT,"A community-driven leaderboard tool that enables developers to visualize, track, and compete based on their Claude Code usage statistics. It features robust data analytics, GitHub OAuth, data validation, and user-friendly CLI/web submission methods.",FALSE,FALSE,2025-07-02:22-48-41,,,
tool-8d6f8d23,Auto-Claude,Tooling,Orchestrators,https://github.com/AndyMik90/Auto-Claude,,AndyMik90,https://github.com/AndyMik90,TRUE,2026-02-13:20-02-48,2026-03-23:10-38-16,2026-03-02:01-57-05,AGPL-3.0,"Autonomous multi-agent coding framework for Claude Code (Claude Agent SDK) that integrates the full SDLC - ""plans, builds, and validates software for you"". Features a slick kanban-style UI and a well-designed but not over-engineered agent orchestration system.",FALSE,FALSE,2025-12-04:22-10-40,2026-02-20:11-47-15,v2.7.6,github-releases
tool-3b3bedca,Claude Code Flow,Tooling,Orchestrators,https://github.com/ruvnet/claude-code-flow,,ruvnet,https://github.com/ruvnet,TRUE,2025-07-29,2026-04-11:16-20-01,2026-03-02:01-57-09,MIT,"This mode serves as a code-first orchestration layer, enabling Claude to write, edit, test, and optimize code autonomously across recursive agent cycles.",FALSE,FALSE,2025-06-02:21-24-20,2026-04-11:16-20-20,v3.5.80,github-releases
tool-5d0685f2,Claude Squad,Tooling,Orchestrators,https://github.com/smtg-ai/claude-squad,,smtg-ai,https://github.com/smtg-ai,TRUE,2025-07-29,2026-03-28:23-34-19,2026-03-02:01-57-11,AGPL-3.0,"Claude Squad is a terminal app that manages multiple Claude Code, Codex (and other local agents including Aider) in separate workspaces, allowing you to work on multiple tasks simultaneously.",FALSE,FALSE,2025-03-09:21-02-23,2026-03-12:07-40-53,v1.0.17,github-releases
tool-1af2fe4c,Claude Swarm,Tooling,Orchestrators,https://github.com/parruda/claude-swarm,,parruda,https://github.com/parruda,TRUE,2025-07-29,2026-02-12:01-56-02,2026-03-02:01-57-15,MIT,Launch Claude Code session that is connected to a swarm of Claude Code Agents.,FALSE,FALSE,2025-05-28:21-09-56,2026-02-12:02-02-31,swarm_sdk-v2.7.15,github-releases
tool-a1e3d643,Claude Task Master,Tooling,Orchestrators,https://github.com/eyaltoledano/claude-task-master,,eyaltoledano,https://github.com/eyaltoledano,TRUE,2025-07-29,2026-03-31:15-41-03,2026-03-02:01-57-17,NOASSERTION,"A task management system for AI-driven development with Claude, designed to work seamlessly with Cursor AI.",FALSE,FALSE,2025-03-04:18-55-17,2026-03-31:17-49-05,task-master-ai@0.43.1,github-releases
tool-f81477b3,Claude Task Runner,Tooling,Orchestrators,https://github.com/grahama1970/claude-task-runner,,grahama1970,https://github.com/grahama1970,TRUE,2025-07-29,2025-05-13:23-08-49,2026-03-02:01-57-20,NOT_FOUND,"A specialized tool to manage context isolation and focused task execution with Claude Code, solving the critical challenge of context length limitations and task focus when working with Claude on complex, multi-step projects.",FALSE,TRUE,2025-05-13:13-31-23,,,
tool-b4facb98,Happy Coder,Tooling,Orchestrators,https://github.com/slopus/happy,https://happy.engineering/docs,GrocerPublishAgent,https://peoplesgrocers.com/en/projects,TRUE,2025-08-29:11-57-49,2026-04-13:04-16-14,2026-03-02:01-57-23,MIT,"Spawn and control multiple Claude Codes in parallel from your phone or desktop. Happy Coder runs Claude Code on your hardware, sends push notifications when Claude needs more input or permission, and costs nothing.",FALSE,FALSE,2025-07-13:02-09-56,,,
tool-f660ade2,sudocode,Tooling,Orchestrators,https://github.com/sudocode-ai/sudocode,,ssh-randy,https://github.com/ssh-randy,TRUE,2026-02-26:09-28-31,2026-03-18:22-26-38,2026-03-02:01-57-26,Apache-2.0,Lightweight agent orchestration dev tool that lives in your repo. Integrates with various specification frameworks. It's giving Jira.,FALSE,FALSE,2025-10-15:23-36-20,2026-03-18:23-20-38,v0.2.0,github-releases
tool-9c3f497a,The Agentic Startup,Tooling,Orchestrators,https://github.com/rsmdt/the-startup,,Rudolf Schmidt,https://github.com/rsmdt,TRUE,2025-09-28:14-25-25,2026-04-02:08-46-14,2026-03-02:01-57-28,MIT,"Yet Another Claude Orchestrator - a collection of agents, commands, etc., for shipping production code - but I like this because it's comprehensive, well-written, and one of the few resources that actually uses Output Styles! +10 points!",FALSE,FALSE,2025-08-03:15-01-03,2026-04-02:08-58-34,v3.5.0,github-releases
tool-5fb873b1,TSK - AI Agent Task Manager and Sandbox,Tooling,Orchestrators,https://github.com/dtormoen/tsk,,dtormoen,https://github.com/dtormoen,TRUE,,2026-04-03:05-47-53,2026-03-02:01-57-32,MIT,"A Rust CLI tool that lets you delegate development tasks to AI agents running in sandboxed Docker environments. Multiple agents work in parallel, returning git branches for human review.",FALSE,FALSE,2025-05-31:18-27-41,2026-04-03:03-27-08,v0.10.8,github-releases
tool-df3ddc27,claude-rules-doctor,Tooling,Config Managers,https://github.com/nulone/claude-rules-doctor,,nulone,https://github.com/nulone,TRUE,2026-02-15:00-50-56,2026-02-25:02-41-47,2026-03-02:01-57-35,MIT,"CLI that detects dead `.claude/rules/` files by checking if `paths:` globs actually match files in your repo. Catches silent rule failures where renamed directories or typos in glob patterns cause rules to never apply. Features CI mode (exit 1 on dead rules), JSON output, and verbose mode showing matched files.",FALSE,FALSE,2026-01-28:14-16-00,2026-01-28:23-46-17,v0.2.2,github-releases
tool-7c53b5cb,ClaudeCTX,Tooling,Config Managers,https://github.com/foxj77/claudectx,,John Fox,https://github.com/foxj77,TRUE,2026-02-14:00-00-00,2026-03-26:20-57-17,2026-03-02:01-57-37,MIT,claudectx lets you switch your entire Claude Code configuration with a single command.,FALSE,FALSE,,2026-03-26:20-58-04,v1.2.2,github-releases
status-d69e91f3,CCometixLine - Claude Code Statusline,Status Lines,General,https://github.com/Haleclipse/CCometixLine,,Haleclipse,https://github.com/Haleclipse,TRUE,2025-12-06:14-50-30,2026-03-14:17-54-39,2026-03-02:01-57-40,NOT_FOUND,"A high-performance Claude Code statusline tool written in Rust with Git integration, usage tracking, interactive TUI configuration, and Claude Code enhancement utilities.",FALSE,FALSE,2025-08-11:16-23-41,2026-03-14:18-05-45,v1.1.2,github-releases
status-4e8a47cf,ccstatusline,Status Lines,General,https://github.com/sirmalloc/ccstatusline,https://www.npmjs.com/package/ccstatusline,sirmalloc,https://github.com/sirmalloc,TRUE,2025-08-12:19-47-59,2026-04-08:17-50-43,2026-03-02:01-57-42,MIT,"A highly customizable status line formatter for Claude Code CLI that displays model info, git branch, token usage, and other metrics in your terminal.",FALSE,FALSE,2025-08-08:11-20-28,,,
