ID,Display Name,Category,Sub-Category,Primary Link,Secondary Link,Author Name,Author Link,Active,Date Added,Last Modified,Last Checked,License,Description,Removed From Origin,Stale,Repo Created,Latest Release,Release Version,Release Source
skill-ca8cbc21,AgentSys,Agent Skills,General,https://github.com/avifenesh/agentsys,,avifenesh,https://github.com/avifenesh,TRUE,2026-02-13:20-35-26,2026-04-11:03-15-24,2026-03-02:01-53-27,MIT,"Workflow automation system for Claude with a group of useful plugins, agents, and skills. Automates task-to-production workflows, PR management, code cleanup, performance investigation, drift detection, and multi-agent code review. Includes [agnix](https://github.com/avifenesh/agnix) for linting agent configurations. Built on thousands of lines of code with thousands of tests. Uses deterministic detection (regex, AST) with LLM judgment for efficiency. Used on many production systems.",FALSE,FALSE,2026-01-15:09-32-54,2026-04-11:03-17-59,v5.8.3,github-releases
skill-bd56dc67,"AI Agent, AI Spy",Agent Skills,General,https://youtu.be/0ANECpNdt-4,,Whittaker & Tiwari,https://signalfoundation.org/,TRUE,2026-01-27:18-06-06,,2026-03-02:01-53-29,No License / Not Specified,"Members from the Signal Foundation with some really great tips and tricks on how to turn your operating system into an instrument of total surveillance, and why some companies are doing this really awesome thing. [warning: YouTube link]",FALSE,FALSE,,,,
skill-35039a54,Book Factory,Agent Skills,General,https://github.com/robertguss/claude-skills,https://robertguss.github.io/claude-skills/,Robert Guss,https://github.com/robertguss,TRUE,2026-02-08:14-56-56,2026-03-22:19-14-05,2026-03-02:01-53-32,MIT,A comprehensive pipeline of Skills that replicates traditional publishing infrastructure for nonfiction book creation using specialized Claude skills.,FALSE,FALSE,2026-01-19:17-01-57,,,
skill-a9ada349,cc-devops-skills,Agent Skills,General,https://github.com/akin-ozer/cc-devops-skills,,akin-ozer,https://github.com/akin-ozer,TRUE,2026-01-30:13-53-47,2026-03-27:07-54-56,2026-03-02:01-53-34,Apache-2.0,"Immensely detailed set of skills for DevOps Engineers (or anyone who has to deploy code, really). Works with validations, generators, shell scripts and CLI tools to create high quality IaC code for about any platform you've ever struggled painfully to work with. Worth downloading even just as a source of documentation.",FALSE,FALSE,2025-12-05:11-53-24,2026-03-04:06-44-32,v1.0.0,github-releases
skill-448a4572,Claude Code Agents,Agent Skills,General,https://github.com/undeadlist/claude-code-agents,,Paul - UndeadList,https://github.com/undeadlist,TRUE,2026-02-11:20-41-43,2026-03-22:00-38-28,2026-03-02:01-53-37,MIT,"Comprehensive E2E development workflow with helpful Claude Code subagent prompts for solo devs. Run multiple auditors in parallel, automate fix cycles with micro-checkpoint protocols, and do browser-based QA. Includes strict protocols to prevent AI going rogue.",FALSE,FALSE,2025-12-24:06-47-31,,,
skill-50f919d5,Claude Codex Settings,Agent Skills,General,https://github.com/fcakyon/claude-codex-settings,,fatih akyon,https://github.com/fcakyon,TRUE,2025-12-18:05-04-59,2026-04-11:23-08-34,2026-03-02:01-53-40,Apache-2.0,"A well-organized, well-written set of plugins covering core developer activities, such as working with common cloud platforms like GitHub, Azure, MongoDB, and popular services such as Tavily, Playwright, and more. Clear, not overly-opinionated, and compatible with a few other providers.",FALSE,FALSE,2025-07-09:07-46-08,2026-03-24:07-14-26,v2.3.0,github-releases
skill-aeb4b7fa,Claude Mountaineering Skills,Agent Skills,General,https://github.com/dreamiurg/claude-mountaineering-skills,,Dmytro Gaivoronsky,https://github.com/dreamiurg,TRUE,2025-12-18:05-53-27,2026-03-29:19-00-43,2026-03-02:01-53-43,MIT,"Claude Code skill that automates mountain route research for North American peaks. Aggregates data from 10+ mountaineering sources like Mountaineers.org, PeakBagger.com and SummitPost.com to generate detailed route beta reports with weather, avalanche conditions, and trip reports.",FALSE,FALSE,2025-10-21:04-45-27,2026-01-30:09-50-19,v4.0.2,github-releases
skill-53ad2e70,Claude Scientific Skills,Agent Skills,General,https://github.com/K-Dense-AI/claude-scientific-skills,,K-Dense,https://github.com/K-Dense-AI/,TRUE,2026-03-02:13-30-22,2026-04-13:00-44-14,2026-03-02:13-30-22,MIT,"""A set of ready-to-use Agent Skills for research, science, engineering, analysis, finance and writing."" That's their description - modest, simple. That's how you can tell this is really one of the best skills repos on GitHub. If you've ever thought about getting a PhD... just read all of these documents instead. Also I think it IS an AI agent or something? Awesome.",FALSE,FALSE,2025-10-19:20-54-16,2026-04-13:00-44-28,v2.37.1,github-releases
skill-faba0faa,Codex Skill,Agent Skills,General,https://github.com/skills-directory/skill-codex,,klaudworks,https://github.com/klaudworks,TRUE,2025-10-27:13-24-10,2026-04-10:08-15-32,2026-03-02:01-53-45,MIT,"Enables users to prompt codex from claude code. Unlike the raw codex mcp server, this skill infers parameters such as model, reasoning effort, sandboxing from your prompt or asks you to specify them. It also simplifies continuing prior codex sessions so that codex can continue with the prior context.",FALSE,FALSE,2025-10-21:19-38-10,,,
skill-bff92ab6,Compound Engineering Plugin,Agent Skills,General,https://github.com/EveryInc/compound-engineering-plugin,,EveryInc,https://github.com/EveryInc,TRUE,2026-01-22:13-46-43,2026-04-13:03-16-09,2026-03-02:01-53-48,MIT,"A very pragmatic set of well-designed agents, skills, and commands, built around a discipline of turning past mistakes and errors into lessons and opportunities for future growth and improvement. Good documentation.",FALSE,FALSE,2025-10-09:20-37-38,2026-04-11:00-44-41,compound-engineering-v2.65.0,github-releases
skill-e5b92436,Context Engineering Kit,Agent Skills,General,https://github.com/NeoLabHQ/context-engineering-kit,https://github.com/NeoLabHQ/context-engineering-kit?tab=readme-ov-file#reflexion,Vlad Goncharov,https://github.com/LeoVS09,TRUE,2025-12-06:14-29-49,2026-04-06:00-48-04,2026-03-02:01-53-51,GPL-3.0,Hand-crafted collection of advanced context engineering techniques and patterns with minimal token footprint focused on improving agent result quality.,FALSE,FALSE,2025-11-13:23-23-04,2026-04-06:00-48-27,v2.2.3,github-releases
skill-3b08df01,Everything Claude Code,Agent Skills,General,https://github.com/affaan-m/everything-claude-code,,Affaan Mustafa,https://github.com/affaan-m/,TRUE,2026-01-24:17-41-01,2026-04-13:05-33-32,2026-03-02:01-53-54,MIT,"Top-notch, well-written resources covering ""just about everything"" from core engineering domains. What's nice about this ""everything-"" store is most of the resources have significant standalone value and unlike some all-encompassing frameworks, although you can opt in to the author's own specific workflow patterns if you choose, the individual resources offer exemplary patterns in (just about) every Claude Code feature you can find (apologies to the Output Styles devotees).",FALSE,FALSE,2026-01-18:01-49-33,2026-04-05:20-20-57,v1.10.0,github-releases
skill-d69e3bc4,Fullstack Dev Skills,Agent Skills,General,https://github.com/jeffallan/claude-skills,,jeffallan,https://github.com/jeffallan,TRUE,2026-02-05:03-33-57,2026-03-23:22-39-26,2026-03-02:01-53-56,MIT,"A comprehensive Claude Code plugin with 65 specialized skills covering full-stack development across a wide range of specific frameworks. Features 9 project workflow commands for Jira/Confluence integration and, notably, an interesting approach to context engineering via a  `/common-ground` command that surfaces Claude's hidden assumptions about your project. This is a smart thing to do.",FALSE,FALSE,2025-10-20:17-46-41,2026-03-23:21-05-49,v0.4.11,github-releases
skill-cf9ee629,read-only-postgres,Agent Skills,General,https://github.com/jawwadfirdousi/agent-skills,,jawwadfirdousi,https://github.com/jawwadfirdousi,TRUE,2026-02-04:13-50-06,2026-03-08:19-42-23,2026-03-02:01-53-59,NOT_FOUND,"Read-only PostgreSQL query skill for Claude Code. Executes SELECT/SHOW/EXPLAIN/WITH queries across configured databases with strict validation, timeouts, and row limits. Supports multiple connections with descriptions for database selection.",FALSE,FALSE,2026-02-02:21-31-52,,,
skill-294cc93f,Superpowers,Agent Skills,General,https://github.com/obra/superpowers,,Jesse Vincent,https://github.com/obra,TRUE,2025-12-22:07-20-47,2026-04-06:22-48-58,2026-03-02:01-54-02,MIT,"A strong bundle of core competencies for software engineering, with good coverage of a large portion of the SDLC - from planning, reviewing, testing, debugging... Well written, well organized, and adaptable. The author refers to them as ""superpowers"", but many of them are just consolidating engineering best practices - which sometimes does feel like a superpower when working with Claude Code.",FALSE,FALSE,2025-10-09:19-57-31,2026-03-31:19-25-11,v5.0.7,github-releases
skill-17aac0cc,Trail of Bits Security Skills,Agent Skills,General,https://github.com/trailofbits/skills,,Trail of Bits,https://github.com/trailofbits,TRUE,2026-01-19:01-35-02,2026-04-01:14-50-10,2026-03-02:01-54-05,CC-BY-SA-4.0,"A very professional collection of over a dozen security-focused skills for code auditing and vulnerability detection. Includes skills for static analysis with CodeQL and Semgrep, variant analysis across codebases, fix verification, and differential code review.",FALSE,FALSE,2026-01-14:20-24-03,,,
skill-bc4e0f53,TÂCHES Claude Code Resources,Agent Skills,General,https://github.com/glittercowboy/taches-cc-resources,,TÂCHES,https://github.com/glittercowboy,TRUE,2025-12-21:22-59-37,2026-04-01:15-10-52,2026-03-02:01-54-07,MIT,"A well-balanced, ""down-to-Earth"" set of sub agents, skills, and commands,  that are well-organized, easy to read, and a healthy focus on ""meta""-skills/agents, like ""skill-auditor"", hook creation, etc. - the kind of things you can adapt to your workflow, and not the other way around.",FALSE,FALSE,2025-11-13:18-01-51,,,
skill-1fc653a0,Web Assets Generator Skill,Agent Skills,General,https://github.com/alonw0/web-asset-generator,,Alon Wolenitz,https://github.com/alonw0,TRUE,2025-10-28:10-03-26,2026-01-28:09-11-01,2026-03-02:01-54-10,MIT,"Easily generate web assets from Claude Code including favicons, app icons (PWA), and social media meta images (Open Graph) for Facebook, Twitter, WhatsApp, and LinkedIn. Handles image resizing, text-to-image generation, emojis, and provides proper HTML meta tags.",FALSE,FALSE,2025-10-21:07-41-31,,,
wf-996c4dd3,AB Method,Workflows & Knowledge Guides,General,https://github.com/ayoubben18/ab-method,,Ayoub Bensalah,https://github.com/ayoubben18,TRUE,2025-09-12:15-03-57,2025-11-10:21-57-15,2026-03-02:01-54-13,MIT,"A principled, spec-driven workflow that transforms large problems into focused, incremental missions using Claude Code's specialized sub agents. Includes slash-commands, sub agents, and specialized workflows designed for specific parts of the SDLC.",FALSE,TRUE,2025-08-10:15-41-14,2025-11-10:21-57-20,v2.3.0,github-releases
wf-7d4f4706,Agentic Workflow Patterns,Workflows & Knowledge Guides,General,https://github.com/ThibautMelen/agentic-workflow-patterns,,ThibautMelen,https://github.com/ThibautMelen,TRUE,2025-11-26:16-41-49,2025-12-08:13-09-58,2026-03-02:01-54-17,NOT_FOUND,"A comprehensive and well-documented collection of agentic patterns from Anthropic docs, with colorful Mermaid diagrams and code examples for each pattern. Covers Subagent Orchestration, Progressive Skills, Parallel Tool Calling, Master-Clone Architecture, Wizard Workflows, and more. Also compatible with other providers.",FALSE,FALSE,2025-11-25:12-38-17,,,
wf-8376d518,Blogging Platform Instructions,Workflows & Knowledge Guides,General,https://github.com/cloudartisan/cloudartisan.github.io/tree/main/.claude/commands,,cloudartisan,https://github.com/cloudartisan,TRUE,2025-07-29,2026-04-12:10-58-49,2026-03-02:01-54-19,CC-BY-SA-4.0,"Provides a well-structured set of commands for publishing and maintaining a blogging platform, including commands for creating posts, managing categories, and handling media files.",FALSE,FALSE,2022-08-30:06-33-20,,,
wf-af6dda20,Claude Code Documentation Mirror,Workflows & Knowledge Guides,General,https://github.com/ericbuess/claude-code-docs,,Eric Buess,https://github.com/ericbuess,TRUE,2025-11-14:06-01-47,2026-04-13:04-04-57,2026-03-02:01-54-22,NOASSERTION,"A mirror of the Anthropic &copy; PBC documentation pages for Claude Code, updated every few hours. Can come in handy when trying to stay on top of the ever-expanding feature-set of Dr. Claw D. Code, Ph.D.",FALSE,FALSE,2025-07-09:14-15-29,2025-11-14:21-55-13,v0.3.3,github-releases
wf-fd5a0e6b,Claude Code Handbook,Workflows & Knowledge Guides,General,https://nikiforovall.blog/claude-code-rules/,,nikiforovall,https://github.com/nikiforovall,TRUE,2025-12-06:14-34-58,,2026-03-02:01-54-23,MIT,"Collection of best practices, tips, and techniques for Claude Code development workflows, enhanced with distributable plugins",FALSE,,,,,
wf-82428576,Claude Code Infrastructure Showcase,Workflows & Knowledge Guides,General,https://github.com/diet103/claude-code-infrastructure-showcase,,diet103,https://github.com/diet103,TRUE,2025-11-06:03-29-17,2025-10-31:01-41-24,2026-03-02:01-54-25,MIT,"A remarkably innovative approach to working with Skills, the centerpiece of which being a technique that leverages hooks to ensure that Claude intelligently selects and activates the appropriate Skill given the current context. Well-documented and adaptable to different projects and workflows.",FALSE,TRUE,2025-10-29:21-54-53,,,
wf-a59ba559,Claude Code PM,Workflows & Knowledge Guides,General,https://github.com/automazeio/ccpm,,Ran Aroussi,https://github.com/ranaroussi,TRUE,2025-09-01:07-52-50,2026-03-18:12-15-22,2026-03-02:01-54-28,MIT,"Really comprehensive and feature-packed project-management workflow for Claude Code. Numerous specialized agents, slash-commands, and strong documentation.",FALSE,TRUE,2025-08-18:23-20-08,,,
wf-fc9e9c97,Claude Code Repos Index,Workflows & Knowledge Guides,General,https://github.com/danielrosehill/Claude-Code-Repos-Index,,Daniel Rosehill,https://github.com/danielrosehill,TRUE,2025-12-30:22-26-20,2026-04-10:12-32-36,2026-03-02:01-54-30,NOT_FOUND,"This is either the work of a prolific genius, or a very clever bot (or both), although it hardly matters because the quality is so good - an index of 75+ Claude Code repositories published by the author - and I'm not talking about slop. CMS, system design, deep research, IoT, agentic workflows, server management, personal health... If you spot the lie, let me know, otherwise please check these out.",FALSE,FALSE,2025-10-11:21-40-41,,,
wf-b3c6f3e1,Claude Code System Prompts,Workflows & Knowledge Guides,General,https://github.com/Piebald-AI/claude-code-system-prompts,,Piebald AI,https://github.com/Piebald-AI,TRUE,2025-12-18:05-38-00,2026-04-12:02-50-16,2026-03-02:01-54-33,MIT,"All parts of Claude Code's system prompt, including builtin tool descriptions, sub agent prompts (Plan/Explore/Task), utility prompts (CLAUDE.md, compact, Bash cmd, security review, agent creation, etc.). Updated for each Claude Code version.",FALSE,FALSE,2025-11-19:04-50-55,2026-04-12:02-50-21,v2.1.104,github-releases
wf-cb2d350a,Claude Code Tips,Workflows & Knowledge Guides,General,https://github.com/ykdojo/claude-code-tips,,ykdojo,https://github.com/ykdojo,TRUE,2025-12-29:17-30-42,2026-04-02:06-27-15,2026-03-02:01-54-36,NOASSERTION,"A nice variety of 35+ brief but information-dense Claude Code tips covering voice input, system prompt patching, container workflows for risky tasks, conversation cloning(!), multi-model orchestration with Gemini CLI, and plenty more. Nice demos, working scripts, a plugin, I'd say this probably has a little something for everyone.",FALSE,FALSE,2025-11-28:00-51-36,2026-03-27:02-16-51,v0.26.7,github-releases
wf-918b0d98,Claude Code Ultimate Guide,Workflows & Knowledge Guides,General,https://github.com/FlorianBruniaux/claude-code-ultimate-guide,,Florian BRUNIAUX,https://www.linkedin.com/in/florian-bruniaux-43408b83/,TRUE,2026-02-11:18-31-46,2026-04-11:11-32-18,2026-03-02:01-54-38,CC-BY-SA-4.0,"A tremendous feat of documentation, this guide covers Claude Code from beginner to power user, with production-ready templates for Claude Code features, guides on agentic workflows, and a lot of great learning materials, including quizzes and a handy ""cheatsheet"". Whether it's the ""ultimate"" guide to Claude Code will be up to the reader, but a valuable resource nonetheless (as with all documentation sites, make sure it's up to date before you bet the farm).",FALSE,FALSE,2026-01-09:13-42-10,2026-04-04:12-35-28,guide-export-v3.38.3,github-releases
wf-84b47071,Claude CodePro,Workflows & Knowledge Guides,General,https://github.com/maxritter/claude-codepro,,Max Ritter,https://www.maxritter.net,TRUE,2025-12-18:06-16-04,2026-04-10:09-16-09,2026-03-02:01-54-42,NOASSERTION,"Professional development environment for Claude Code with spec-driven workflow, TDD enforcement, cross-session memory, semantic search, quality hooks, and modular rules integration. A bit ""heavyweight"" but feature-packed and has wide coverage.",FALSE,FALSE,2025-10-24:05-48-02,2026-04-10:09-10-15,v8.0.7,github-releases
wf-dfd3f3db,claude-code-docs,Workflows & Knowledge Guides,General,https://github.com/costiash/claude-code-docs,https://github.com/costiash/claude-code-docs/blob/main/enhancements%2FCAPABILITIES.md,Constantin Shafranski,https://github.com/costiash,TRUE,2025-11-15:14-18-57,2026-04-13:04-20-56,2026-03-02:01-54-45,MIT,"A mirror of the Anthropic&copy; PBC documentation site for Claude/Code, but with bonus features like full-text search and query-time updates - a nice companion to `claude-code-docs` for up-to-the-minute, fully-indexed information so that Claude Code can read about itself.",FALSE,FALSE,2025-07-09:14-15-29,2026-03-28:21-49-57,v1.1.0,github-releases
wf-666ef1b9,ClaudoPro Directory,Workflows & Knowledge Guides,General,https://github.com/JSONbored/claudepro-directory,https://claudepro.directory/,ghost,https://github.com/JSONbored,TRUE,2025-09-25:13-57-35,2026-04-12:09-41-45,2026-03-02:01-54-47,MIT,"Well-crafted, wide selection of Claude Code hooks, slash commands, subagent files, and more, covering a range of specialized tasks and workflows. Better resources than your average ""Claude-template-for-everything"" site.",FALSE,FALSE,2025-09-15:01-34-08,,,
wf-b98b3b2d,Context Priming,Workflows & Knowledge Guides,General,https://github.com/disler/just-prompt/tree/main/.claude/commands,,disler,https://github.com/disler,TRUE,,2025-08-10:19-05-50,2026-03-02:01-54-50,NOT_FOUND,Provides a systematic approach to priming Claude Code with comprehensive project context through specialized commands for different project scenarios and development contexts.,FALSE,TRUE,2025-03-20:17-36-32,,,
wf-f9bf0f75,Design Review Workflow,Workflows & Knowledge Guides,General,https://github.com/OneRedOak/claude-code-workflows/tree/main/design-review,,Patrick Ellis,https://github.com/OneRedOak,TRUE,2025-09-11:20-01-42,2025-09-14:07-33-27,2026-03-02:01-54-52,MIT,"A tailored workflow for enabling automated UI/UX design review, including specialized sub agents, slash commands, `CLAUDE.md` excerpts, and more. Covers a broad range of criteria from responsive design to accessibility.",FALSE,TRUE,2025-08-12:03-34-54,,,
wf-28d0fc92,Laravel TALL Stack AI Development Starter Kit,Workflows & Knowledge Guides,General,https://github.com/tott/laravel-tall-claude-ai-configs,,tott,https://github.com/tott,TRUE,2025-08-17:12-59-22,2025-08-08:14-35-05,2026-03-02:01-54-55,MIT,"Transform your Laravel TALL (Tailwind, AlpineJS, Laravel, Livewire) stack development with comprehensive Claude Code configurations that provide intelligent assistance, systematic workflows, and domain expert consultation.",FALSE,TRUE,2025-08-08:13-08-59,,,
wf-98ee6249,Learn Claude Code,Workflows & Knowledge Guides,General,https://github.com/shareAI-lab/learn-claude-code,,shareAI-Lab,https://github.com/shareAI-lab/,TRUE,2026-01-27:20-55-32,2026-04-07:22-14-44,2026-03-02:01-54-58,MIT,"A really interesting analysis of how coding agents like Claude Code are designed. It attempts to break an agent down into its fundamental parts and reconstruct it with minimal code. Great learning resource. Final product is a rudimentary agent with skills, sub-agents, and a todo-list in roughly a few hundred lines of Python.",FALSE,FALSE,2025-06-29:15-34-15,,,
wf-a50134d3,learn-faster-kit,Workflows & Knowledge Guides,General,https://github.com/cheukyin175/learn-faster-kit,,Hugo Lau,https://github.com/cheukyin175,TRUE,2025-12-03:07-10-47,2025-12-04:05-33-17,2026-03-02:01-55-02,MIT,"A creative educational framework for Claude Code, inspired by the ""FASTER"" approach to self-teaching. Ships with a variety of agents, slash commands, and tools that enable Claude Code to help you progress at your own pace, employing well-established pedagogical techniques like active learning and spaced repetition.",FALSE,FALSE,2025-11-10:08-22-09,,,
wf-43a18fc2,n8n_agent,Workflows & Knowledge Guides,General,https://github.com/kingler/n8n_agent/tree/main/.claude/commands,,kingler,https://github.com/kingler,TRUE,,2025-05-16:17-30-29,2026-03-02:01-55-05,NOT_FOUND,"Amazing comprehensive set of comments for code analysis, QA, design, documentation, project structure, project management, optimization, and many more.",FALSE,TRUE,2025-05-16:17-30-29,,,
wf-1fddaad0,Project Bootstrapping and Task Management,Workflows & Knowledge Guides,General,https://github.com/steadycursor/steadystart/tree/main/.claude/commands,,steadycursor,https://github.com/steadycursor,TRUE,,2025-08-03:20-24-42,2026-03-02:01-55-08,NOT_FOUND,"Provides a structured set of commands for bootstrapping and managing a new project, including meta-commands for creating and editing custom slash-commands.",FALSE,TRUE,2024-05-14:22-13-33,,,
wf-bdb46cd1,"Project Management, Implementation, Planning, and Release",Workflows & Knowledge Guides,General,https://github.com/scopecraft/command/tree/main/.claude/commands,,scopecraft,https://github.com/scopecraft,TRUE,,2025-11-09:12-20-07,2026-03-02:01-55-10,NOT_FOUND,Really comprehensive set of commands for all aspects of SDLC.,FALSE,TRUE,2025-05-10:17-23-27,2025-06-06:04-25-20,v0.16.0,github-releases
wf-42a8d5a5,Project Workflow System,Workflows & Knowledge Guides,General,https://github.com/harperreed/dotfiles/tree/master/.claude/commands,,harperreed,https://github.com/harperreed,TRUE,2025-07-29,2026-03-28:03-32-17,2026-03-02:01-55-13,NOT_FOUND,"A set of commands that provide a comprehensive workflow system for managing projects, including task management, code review, and deployment processes.",FALSE,FALSE,2020-08-29:19-56-31,,,
wf-291eeb4a,RIPER Workflow,Workflows & Knowledge Guides,General,https://github.com/tony/claude-code-riper-5,,Tony Narlock,https://tony.sh,TRUE,2025-10-10:09-52-21,2026-02-08:00-06-34,2026-03-02:01-55-16,MIT,"Structured development workflow enforcing separation between Research, Innovate, Plan, Execute, and Review phases. Features consolidated subagents for context-efficiency, branch-aware memory bank, and strict mode enforcement for guided development.",FALSE,FALSE,2025-09-06:18-05-26,,,
wf-eee9a073,Shipping Real Code w/ Claude,Workflows & Knowledge Guides,General,https://diwank.space/field-notes-from-shipping-real-code-with-claude,,Diwank,https://github.com/creatorrr,TRUE,,,2026-03-02:01-55-16,NOT_FOUND,"A detailed blog post explaining the author's process for shipping a product with Claude Code, including CLAUDE.md files and other interesting resources.",FALSE,,,,,
wf-b4fe16fa,Simone,Workflows & Knowledge Guides,General,https://github.com/Helmi/claude-simone,,Helmi,https://github.com/Helmi,TRUE,2025-07-29,2025-08-26:12-11-04,2026-03-02:01-55-19,MIT,"A broader project management workflow for Claude Code that encompasses not just a set of commands, but a system of documents, guidelines, and processes to facilitate project planning and execution.",FALSE,TRUE,2025-05-23:12-05-25,2025-08-19:11-27-06,simone-mcp/v0.4.0,github-releases
wf-61bd7b69,awesome-ralph,Workflows & Knowledge Guides,Ralph Wiggum,https://github.com/snwfdhmp/awesome-ralph,,Martin Joly,https://github.com/snwfdhmp,TRUE,2026-02-04:13-24-10,2026-02-03:08-34-42,2026-03-02:01-55-22,NOT_FOUND,"A curated list of resources about Ralph, the AI coding technique that runs AI coding agents in automated loops until specifications are fulfilled.",FALSE,FALSE,2026-01-19:08-42-54,,,
wf-8ceac0c4,Ralph for Claude Code,Workflows & Knowledge Guides,Ralph Wiggum,https://github.com/frankbria/ralph-claude-code,,Frank Bria,https://github.com/frankbria,TRUE,2026-01-09:16-32-31,2026-04-04:21-16-20,2026-03-02:01-55-25,MIT,"An autonomous AI development framework that enables Claude Code to work iteratively on projects until completion. Features intelligent exit detection, rate limiting, circuit breaker patterns, and comprehensive safety guardrails to prevent infinite loops and API overuse. Built with Bash, integrated with tmux for live monitoring, and includes 75+ comprehensive tests.",FALSE,FALSE,2025-08-27:16-03-46,,,
