ID,Display Name,Category,Sub-Category,Primary Link,Secondary Link,Author Name,Author Link,Active,Date Added,Last Modified,Last Checked,License,Description,Removed From Origin,Stale,Repo Created,Latest Release,Release Version,Release Source
cmd-a8870199,/prd-generator,Slash-Commands,Project & Task Management,https://github.com/dredozubov/prd-generator,,Denis Redozubov,https://github.com/dredozubov,TRUE,2026-01-30:02-03-18,2026-01-14:10-29-44,2026-03-02:02-00-11,MIT,"A Claude Code plugin that generates comprehensive Product Requirements Documents (PRDs) from conversation context. Invoke `/create-prd` after discussing requirements and it produces a complete PRD with all standard sections including Executive Summary, User Stories, MVP Scope, Architecture, Success Criteria, and Implementation Phases.",FALSE,FALSE,2026-01-14:10-27-43,,,
cmd-80018864,/project_hello_w_name,Slash-Commands,Project & Task Management,https://github.com/disler/just-prompt/blob/main/.claude/commands/project_hello_w_name.md,,disler,https://github.com/disler,TRUE,2025-07-29,2025-08-10:19-05-50,2026-03-02:02-00-13,NOT_FOUND,"Creates customizable greeting components with name input, demonstrating argument passing, component reusability, state management, and user input handling.",FALSE,TRUE,2025-03-20:17-36-32,,,
cmd-1bc55517,/todo,Slash-Commands,Project & Task Management,https://github.com/chrisleyva/todo-slash-command/blob/main/todo.md,,chrisleyva,https://github.com/chrisleyva,TRUE,2025-07-29,2025-06-25:23-12-56,2026-03-02:02-00-16,MIT,"A convenient command to quickly manage project todo items without leaving the Claude Code interface, featuring due dates, sorting, task prioritization, and comprehensive todo list management.",FALSE,TRUE,2025-06-23:19-31-31,,,
cmd-a0a98a9e,/fixing_go_in_graph,Slash-Commands,Miscellaneous,https://github.com/Mjvolk3/torchcell/blob/main/.claude/commands/fixing_go_in_graph.md,,Mjvolk3,https://github.com/Mjvolk3,TRUE,,2026-01-27:17-11-51,2026-03-02:02-00-21,NOT_FOUND,"Focuses on Gene Ontology annotation integration in graph databases, handling multiple data sources, addressing graph representation issues, and ensuring correct data incorporation.",FALSE,TRUE,2023-07-24:22-56-56,2025-08-07:03-40-40,v1.1.0,github-releases
cmd-dc2a5edd,/review_dcell_model,Slash-Commands,Miscellaneous,https://github.com/Mjvolk3/torchcell/blob/main/.claude/commands/review_dcell_model.md,,Mjvolk3,https://github.com/Mjvolk3,TRUE,2025-07-29,2026-01-27:17-11-51,2026-03-02:02-00-26,NOT_FOUND,"Reviews old Dcell implementation files, comparing with newer Dango model, noting changes over time, and analyzing refactoring approaches for better code organization.",FALSE,TRUE,2023-07-24:22-56-56,2025-08-07:03-40-40,v1.1.0,github-releases
cmd-0a1fa75a,/use-stepper,Slash-Commands,Miscellaneous,https://github.com/zuplo/docs/blob/main/.claude/commands/use-stepper.md,,zuplo,https://github.com/zuplo,TRUE,2025-07-29,2026-04-08:22-57-28,2026-03-02:02-00-28,NOT_FOUND,"Reformats documentation to use React Stepper component, transforming heading formats, applying proper indentation, and maintaining markdown compatibility with admonition formatting.",FALSE,TRUE,2021-08-03:14-14-19,,,
claude-ac32c909,AI IntelliJ Plugin,CLAUDE.md Files,Language-Specific,https://github.com/didalgolab/ai-intellij-plugin/blob/main/CLAUDE.md,,didalgolab,https://github.com/didalgolab,TRUE,2025-07-29,2025-03-26:22-20-18,2026-03-02:02-00-31,Apache-2.0,"Provides comprehensive Gradle commands for IntelliJ plugin development with platform-specific coding patterns, detailed package structure guidelines, and clear internationalization standards.",FALSE,TRUE,2023-05-04:01-47-31,2024-10-03:20-16-25,v1.1.1,github-releases
claude-bbaa0c15,AWS MCP Server,CLAUDE.md Files,Language-Specific,https://github.com/alexei-led/aws-mcp-server/blob/main/CLAUDE.md,,alexei-led,https://github.com/alexei-led,TRUE,2025-07-29,2026-02-27:14-31-23,2026-03-02:02-00-33,MIT,"Features multiple Python environment setup options with detailed code style guidelines, comprehensive error handling recommendations, and security considerations for AWS CLI interactions.",FALSE,FALSE,2025-03-11:19-44-05,2026-02-27:14-31-51,v1.7.0,github-releases
claude-e130a9c3,DroidconKotlin,CLAUDE.md Files,Language-Specific,https://github.com/touchlab/DroidconKotlin/blob/main/CLAUDE.md,,touchlab,https://github.com/touchlab,TRUE,2025-07-29,2025-12-10:14-29-37,2026-03-02:02-00-36,Apache-2.0,Delivers comprehensive Gradle commands for cross-platform Kotlin Multiplatform development with clear module structure and practical guidance for dependency injection.,FALSE,TRUE,2018-07-13:12-15-58,,,
claude-1279cf13,EDSL,CLAUDE.md Files,Language-Specific,https://github.com/hesreallyhim/awesome-claude-code/blob/main/resources/claude.md-files/EDSL/CLAUDE.md,,expectedparrot,https://github.com/expectedparrot,TRUE,2025-07-29,2026-04-13:04-13-30,2025-09-21:08-04-24,MIT,"Offers detailed build and test commands with strict code style enforcement, comprehensive testing requirements, and standardized development workflow using Black and mypy.",TRUE,,2025-04-19:21-00-28,,,
claude-3ae444b3,Giselle,CLAUDE.md Files,Language-Specific,https://github.com/giselles-ai/giselle/blob/main/CLAUDE.md,,giselles-ai,https://github.com/giselles-ai,TRUE,2025-07-29,2026-04-06:01-13-12,2026-03-02:02-00-39,Apache-2.0,Provides detailed build and test commands using pnpm and Vitest with strict code formatting requirements and comprehensive naming conventions for code consistency.,FALSE,FALSE,2023-12-21:04-25-41,2026-04-03:00-08-22,v0.75.3,github-releases
claude-b302b042,HASH,CLAUDE.md Files,Language-Specific,https://github.com/hashintel/hash/blob/main/CLAUDE.md,,hashintel,https://github.com/hashintel,TRUE,2025-07-29,2026-04-09:20-08-33,2026-03-02:02-00-42,NOASSERTION,"Features comprehensive repository structure breakdown with strong emphasis on coding standards, detailed Rust documentation guidelines, and systematic PR review process.",FALSE,FALSE,2019-07-15:16-19-37,2026-03-28:15-15-13,@hashintel/ds-theme@0.1.2,github-releases
claude-6dc32b06,Inkline,CLAUDE.md Files,Language-Specific,https://github.com/inkline/inkline/blob/main/CLAUDE.md,,inkline,https://github.com/inkline,TRUE,2025-07-29,2025-05-18:14-06-27,2026-03-02:02-00-45,NOASSERTION,"Structures development workflow using pnpm with emphasis on TypeScript and Vue 3 Composition API, detailed component creation process, and comprehensive testing recommendations.",FALSE,TRUE,2018-02-07:12-58-42,2024-11-18:06-40-57,v4.7.2,github-releases
claude-1821727a,JSBeeb,CLAUDE.md Files,Language-Specific,https://github.com/mattgodbolt/jsbeeb/blob/main/CLAUDE.md,,mattgodbolt,https://github.com/mattgodbolt,TRUE,2025-07-29,2026-04-12:22-37-11,2026-03-02:02-00-47,GPL-3.0,"Provides development guide for JavaScript BBC Micro emulator with build and testing instructions, architecture documentation, and debugging workflows.",FALSE,TRUE,2011-10-03:11-26-13,2026-04-04:23-46-31,v1.12.0,github-releases
claude-3591a3e4,Lamoom Python,CLAUDE.md Files,Language-Specific,https://github.com/LamoomAI/lamoom-python/blob/main/CLAUDE.md,,LamoomAI,https://github.com/LamoomAI,TRUE,2025-07-29,2025-08-28:13-38-23,2026-03-02:02-00-50,Apache-2.0,"Serves as reference for production prompt engineering library with load balancing of AI Models, API documentation, and usage patterns with examples.",FALSE,TRUE,2024-02-09:12-08-20,,,
claude-2a18266c,LangGraphJS,CLAUDE.md Files,Language-Specific,https://github.com/langchain-ai/langgraphjs/blob/main/CLAUDE.md,,langchain-ai,https://github.com/langchain-ai,TRUE,2025-07-29,2026-04-10:20-58-27,2026-03-02:02-00-53,MIT,"Offers comprehensive build and test commands with detailed TypeScript style guidelines, layered library architecture, and monorepo structure using yarn workspaces.",FALSE,FALSE,2024-01-09:17-40-46,2026-04-07:15-17-34,@langchain/langgraph@1.2.8,github-releases
claude-38b6b458,Metabase,CLAUDE.md Files,Language-Specific,https://github.com/metabase/metabase/blob/master/CLAUDE.md,,metabase,https://github.com/metabase,TRUE,2025-07-29,2026-04-13:04-55-58,2026-03-02:02-00-55,NOASSERTION,"Details workflow for REPL-driven development in Clojure/ClojureScript with emphasis on incremental development, testing, and step-by-step approach for feature implementation.",FALSE,FALSE,2015-02-02:19-28-24,2026-04-09:23-07-27,v0.59.6,github-releases
claude-8ff859d0,SG Cars Trends Backend,CLAUDE.md Files,Language-Specific,https://github.com/sgcarstrends/backend/blob/main/CLAUDE.md,,sgcarstrends,https://github.com/sgcarstrends,TRUE,2025-07-29,2026-04-11:18-42-04,2026-03-02:02-00-59,MIT,"Provides comprehensive structure for TypeScript monorepo projects with detailed commands for development, testing, deployment, and AWS/Cloudflare integration.",FALSE,FALSE,2023-10-29:20-23-43,2026-04-05:10-20-54,v4.65.0,github-releases
claude-28de7758,SPy,CLAUDE.md Files,Language-Specific,https://github.com/spylang/spy/blob/main/CLAUDE.md,,spylang,https://github.com/spylang,TRUE,2025-07-29,2026-04-10:12-15-59,2026-03-02:02-01-02,MIT,"Enforces strict coding conventions with comprehensive testing guidelines, multiple code compilation options, and backend-specific test decorators for targeted filtering.",FALSE,FALSE,2023-05-19:14-23-13,2026-01-08:16-43-33,v0.0.0,github-releases
claude-724817c4,TPL,CLAUDE.md Files,Language-Specific,https://github.com/KarpelesLab/tpl/blob/master/CLAUDE.md,,KarpelesLab,https://github.com/KarpelesLab,TRUE,2025-07-29,2026-01-18:06-24-26,2026-03-02:02-01-05,MIT,"Details Go project conventions with comprehensive error handling recommendations, table-driven testing approach guidelines, and modernization suggestions for latest Go features.",FALSE,TRUE,2020-01-17:17-16-35,,,
claude-6348c9dd,AVS Vibe Developer Guide,CLAUDE.md Files,Domain-Specific,https://github.com/Layr-Labs/avs-vibe-developer-guide/blob/master/CLAUDE.md,,Layr-Labs,https://github.com/Layr-Labs,FALSE,2025-07-29,2025-04-09:18-03-54,2026-03-02:02-01-08,MIT,Structures AI-assisted EigenLayer AVS development workflow with consistent naming conventions for prompt files and established terminology standards for blockchain concepts.,FALSE,TRUE,2025-04-09:00-10-34,,,
claude-3b207e6e,Cursor Tools,CLAUDE.md Files,Domain-Specific,https://github.com/eastlondoner/cursor-tools/blob/main/CLAUDE.md,,eastlondoner,https://github.com/eastlondoner,TRUE,2025-07-29,2025-08-22:08-32-22,2026-03-02:02-01-16,MIT,"Creates a versatile AI command interface supporting multiple providers and models with flexible command options and browser automation through ""Stagehand"" feature.",FALSE,TRUE,2025-01-13:15-05-28,,,
claude-0ce42e78,Guitar,CLAUDE.md Files,Domain-Specific,https://github.com/soramimi/Guitar/blob/master/CLAUDE.md,,soramimi,https://github.com/soramimi,TRUE,2025-07-29,2026-04-11:18-10-34,2026-03-02:02-01-19,GPL-2.0,"Serves as development guide for Guitar Git GUI Client with build commands for various platforms, code style guidelines for contributing, and project structure explanation.",FALSE,TRUE,2016-12-23:16-20-14,2025-11-01:02-46-41,v1.3.1,github-releases
claude-4a956e32,Network Chronicles,CLAUDE.md Files,Domain-Specific,https://github.com/Fimeg/NetworkChronicles/blob/legacy-v1/CLAUDE.md,,Fimeg,https://github.com/Fimeg,TRUE,2025-07-29,2025-08-08:20-07-58,2026-03-02:02-01-21,MIT,"Presents detailed implementation plan for AI-driven game characters with technical specifications for LLM integration, character guidelines, and service discovery mechanics.",FALSE,TRUE,2025-03-05:16-05-30,,,
claude-5479b4e8,Pareto Mac,CLAUDE.md Files,Domain-Specific,https://github.com/ParetoSecurity/pareto-mac/blob/main/CLAUDE.md,,ParetoSecurity,https://github.com/ParetoSecurity,TRUE,2025-07-29,2026-03-17:19-45-20,2026-03-02:02-01-25,GPL-3.0,"Serves as development guide for Mac security audit tool with build instructions, contribution guidelines, testing procedures, and workflow documentation.",FALSE,FALSE,2021-07-12:19-50-40,2026-03-19:09-57-34,1.25.0,github-releases
claude-1d359140,pre-commit-hooks,CLAUDE.md Files,Domain-Specific,https://github.com/aRustyDev/pre-commit-hooks,,aRustyDev,https://github.com/aRustyDev,TRUE,2026-02-07:02-15-05,2025-11-24:05-32-40,2026-03-02:02-01-27,AGPL-3.0,"This repository is about pre-commit-hooks in general, but the `CLAUDE.md` and related `.claude/` documentation is exemplary. Thorough but not verbose. Unlike a lot of `CLAUDE.md`  files, it doesn't primarily consist in shouting at Claude in all-caps. Great learning resource. Also, hooks.",FALSE,TRUE,2024-07-21:21-44-30,2025-07-08:04-22-32,v0.3.0,github-releases
claude-2659fc4a,SteadyStart,CLAUDE.md Files,Domain-Specific,https://github.com/steadycursor/steadystart/blob/main/CLAUDE.md,,steadycursor,https://github.com/steadycursor,TRUE,2025-07-29,2025-08-03:20-24-42,2026-03-02:02-01-30,NOT_FOUND,"Clear and direct instructives about style, permissions, Claude's ""role"", communications, and documentation of Claude Code sessions for other team members to stay abreast.",FALSE,TRUE,2024-05-14:22-13-33,,,
claude-14f59511,Basic Memory,CLAUDE.md Files,Project Scaffolding & MCP,https://github.com/basicmachines-co/basic-memory/blob/main/CLAUDE.md,,basicmachines-co,https://github.com/basicmachines-co,TRUE,2025-07-29,2026-04-10:17-23-19,2026-03-02:02-01-33,AGPL-3.0,Presents an innovative AI-human collaboration framework with Model Context Protocol for bidirectional LLM-markdown communication and flexible knowledge structure for complex projects.,FALSE,FALSE,2024-12-02:22-40-44,2026-03-27:04-10-46,v0.20.3,github-releases
claude-65aa541a,claude-code-mcp-enhanced,CLAUDE.md Files,Project Scaffolding & MCP,https://github.com/grahama1970/claude-code-mcp-enhanced/blob/main/CLAUDE.md,,grahama1970,https://github.com/grahama1970,TRUE,2025-07-29,2025-05-16:16-57-57,2026-03-02:02-01-36,MIT,"Provides detailed and emphatic instructions for Claude to follow as a coding agent, with testing guidance, code examples, and compliance checks.",FALSE,TRUE,2025-05-15:22-30-08,,,
client-5cae6333,Claudable,Alternative Clients,General,https://github.com/opactorai/Claudable,,Ethan Park,https://www.linkedin.com/in/seongil-park/,TRUE,2025-11-01:06-11-51,2026-03-04:11-14-44,2026-03-02:02-01-40,MIT,"Claudable is an open-source web builder that leverages local CLI agents, such as Claude Code and Cursor Agent, to build and deploy products effortlessly.",FALSE,FALSE,2025-08-20:23-21-13,2025-08-30:21-23-05,v1.0.0,github-releases
client-10858fb6,claude-esp,Alternative Clients,General,https://github.com/phiat/claude-esp,,phiat,https://github.com/phiat,TRUE,2026-02-26:09-00-06,2026-04-08:22-05-52,2026-03-02:02-01-43,MIT,"Go-based TUI that streams Claude Code's hidden output (thinking, tool calls, subagents) to a separate terminal. Watch multiple sessions simultaneously, filter by content type, and track background tasks. Ideal for debugging or understanding what Claude is doing under the hood without interrupting your main session.",FALSE,FALSE,2026-01-09:02-29-43,2026-04-08:12-22-01,v0.4.7,github-releases
client-29b7453b,claude-tmux,Alternative Clients,General,https://github.com/nielsgroen/claude-tmux,,Niels Groeneveld,https://github.com/nielsgroen,TRUE,2026-02-26:09-15-28,2026-01-13:17-17-51,2026-03-02:02-01-45,NOASSERTION,"Manage Claude Code within tmux. A tmux popup of all your Claude Code instances, enabling quick switching, status monitoring, session lifecycle management, with git worktree and pull request support.",FALSE,FALSE,2026-01-12:13-31-48,,,
tool-1c31f36c,crystal,Alternative Clients,General,https://github.com/stravu/crystal,,stravu,https://github.com/stravu,TRUE,2025-07-29,2026-02-26:21-44-09,2026-03-02:02-01-48,MIT,"A full-fledged desktop application for orchestrating, monitoring, and interacting with Claude Code agents.",FALSE,FALSE,2025-06-12:15-54-26,2026-02-26:22-26-05,v0.3.5,github-releases
client-b6c9db9e,Omnara,Alternative Clients,General,https://github.com/omnara-ai/omnara,https://omnara.com,Ishaan Sehgal,https://github.com/ishaansehgal99,TRUE,2025-11-01:06-18-53,2025-12-27:20-48-56,2026-03-02:02-01-51,Apache-2.0,"A command center for AI agents that syncs Claude Code sessions across terminal, web, and mobile. Allows for remote monitoring, human-in-the-loop interaction, and team collaboration.",FALSE,FALSE,2025-07-09:02-17-44,2025-11-09:08-02-17,v1.7.0,github-releases
doc-93f22142,Anthropic Documentation,Official Documentation,General,https://docs.claude.com/en/home,,Anthropic,https://github.com/anthropics,TRUE,,,2026-03-02:02-01-52,&copy;,"The official documentation for Claude Code, including installation instructions, usage guidelines, API references, tutorials, examples, loads of information that I won't list individually. Like Claude Code, the documentation is frequently updated.",FALSE,,,,,
doc-b71240b4,Anthropic Quickstarts,Official Documentation,General,https://github.com/anthropics/claude-quickstarts,,Anthropic,https://github.com/anthropics,TRUE,2025-07-29,2026-02-05:20-47-08,2026-03-02:02-01-55,MIT,"Offers comprehensive development guides for three distinct AI-powered demo projects with standardized workflows, strict code style guidelines, and containerization instructions.",FALSE,FALSE,2024-09-03:06-33-15,,,
doc-9703ea36,Claude Code GitHub Actions,Official Documentation,General,https://github.com/anthropics/claude-code-action/tree/main/examples,,Anthropic,https://github.com/anthropics,TRUE,2025-07-29,2026-04-12:20-51-15,2026-03-02:02-01-57,MIT,Official GitHub Actions integration for Claude Code with examples and documentation for automating AI-powered workflows in CI/CD pipelines.,FALSE,FALSE,2025-05-19:15-32-32,2025-08-26:17-01-10,v1,github-releases
output-447d1481,Awesome Claude Code Output Styles (That I Really Like),Output Styles,General,https://github.com/hesreallyhim/awesome-claude-code-output-styles-that-i-really-like,,Really Him,https://github.com/hesreallyhim/,TRUE,2025-11-21:21-57-16,2025-11-21:22-36-37,2026-03-02:02-02-00,MIT,A fun and moderately amusing collection of experimental output styles.,FALSE,TRUE,2025-11-21:17-25-13,,,
output-2d98cb4f,ccoutputstyles,Output Styles,General,https://github.com/viveknair/ccoutputstyles,,Vivek Nair,https://github.com/viveknair,TRUE,2025-09-21:13-11-39,2025-09-02:19-09-24,2026-03-02:02-02-03,MIT,CLI tool and template gallery for customizing Claude Code output styles with pre-built templates. Features over 15 templates at the time of writing!,FALSE,TRUE,2025-08-22:16-22-49,,,
output-ca5630d6,Claude Code Output Styles - Debugging,Output Styles,General,https://github.com/JamieM0/claude-output-styles,,Jamie Matthews,https://github.com/JamieM0,TRUE,2025-12-06:18-14-46,2025-09-18:18-14-32,2026-03-02:02-02-06,MIT,"A small set of well-written output styles, specifically focused on debugging - root cause analysis, systematic, methodical debugging, encouraging a more careful approach to bug-squashing from Claude Code.",FALSE,TRUE,2025-09-18:16-55-27,,,
output-ade86de0,Gen-Alpha Slang,Output Styles,General,https://github.com/sjnims/gen-alpha-output-style,,Steve Nims,https://github.com/sjnims,TRUE,2025-11-25:08-16-31,2026-01-12:22-39-03,2026-03-02:02-02-08,MIT,"This is really... different. I don't know what to say about this one. It does what it says on the tin. You might find it funny, you might want throw up. I'll just say candidly this is included strictly for its potentially comedic awesomeness.",FALSE,FALSE,2025-11-25:02-46-08,,,
